Timestamp,Fecha,Hora,Turno,Sucursal,Inspector,Servicio(0-100),Carnes(0-100),Alimentos(0-100),Tortillas(0-100),Limpieza(0-100),Bitacoras(0-100),Aseo(0-100),Promedio(0-100),Comentarios,DetalleJSON,FotosURLs,FotosIDs,FolderURL,FolderID,NReport,Week,Month,Year,ID,Estatus_Admin,Reviso,Responsable,Responsable Cierre,estatus
10/28/2025 13:35:40,2025-10-28,13:22,AM,Downey,Wilian Aguilar,80,100,100,100,90,80,100,93,"Tomar temperatura a la hora de apertura , para verificar que todo este funcionando.","{""bitacoras"":{""score"":80,""items"":{""i3"":{""label"":""Registros de limpieza firmados"",""score"":0},""i1"":{""score"":100,""label"":""Checklist apertura/cierre completo""},""i2"":{""score"":60,""label"":""Bitácora de temperaturas al día""}}},""servicio"":{""score"":80,""items"":{""i4"":{""label"":""Evita charlas personales en línea"",""score"":60},""i3"":{""label"":""Entrega órdenes con frase de cierre"",""score"":60},""i1"":{""score"":100,""label"":""Saluda y despide cordialmente""},""i2"":{""score"":100,""label"":""Atiende con paciencia y respeto""}}},""alimentos"":{""items"":{""i2"":{""label"":""Quesadillas bien calientes, sin quemar"",""score"":100},""i1"":{""score"":100,""label"":""Respeta porciones estándar (cucharas)""},""i4"":{""label"":""Stickers correctos donde aplica"",""score"":100},""i3"":{""label"":""Burritos bien enrollados, sin dorar de más"",""score"":100}},""score"":100},""carnes"":{""items"":{""i2"":{""score"":100,""label"":""Utensilios limpios, no golpear espátulas""},""i3"":{""label"":""Escurre carnes y rota producto (FIFO)"",""score"":100},""i1"":{""label"":""Controla temperatura (450°/300°) y tiempos"",""score"":100},""i4"":{""score"":100,""label"":""Vigila cebolla asada y porciones""}},""score"":100},""limpieza"":{""items"":{""i4"":{""score"":100,""label"":""Exterior y basureros limpios""},""i1"":{""label"":""Cubetas rojas con sanitizer tibio"",""score"":100},""i2"":{""score"":60,""label"":""Plancha limpia y sin residuos""},""i3"":{""score"":100,""label"":""Baños con insumos completos y sin olores""}},""score"":90},""tortillas"":{""items"":{""i2"":{""score"":100,""label"":""Máx 5 tacos por plato (presentación)""},""i1"":{""score"":100,""label"":""Tortillas bien calientes (aceite solo en orillas)""},""i3"":{""label"":""Reponer a tiempo y mantener frescura"",""score"":100}},""score"":100},""aseo"":{""score"":100,""items"":{""i2"":{""score"":0,""label"":""Uñas cortas, sin joyas/auriculares""},""i3"":{""label"":""Uso correcto de gorra y guantes"",""score"":100},""i1"":{""score"":100,""label"":""Uniforme limpio y completo""}}}}","https://drive.google.com/file/d/1Yu3pBmU2-Q_pwRh2Ow6cCPBrDOIpLMl2/view?usp=drivesdk
https://drive.google.com/file/d/1aQKHJ4f0TeYrdoQkym8Vl6h46k5GvZyT/view?usp=drivesdk
https://drive.google.com/file/d/19Jk5sxnIZXy95GKTyLDYhDOZx2Avi1u4/view?usp=drivesdk
https://drive.google.com/file/d/11M-YQyYRK2wcriNAP2AEnr7eVLuUvNsh/view?usp=drivesdk","1Yu3pBmU2-Q_pwRh2Ow6cCPBrDOIpLMl2
1aQKHJ4f0TeYrdoQkym8Vl6h46k5GvZyT
19Jk5sxnIZXy95GKTyLDYhDOZx2Avi1u4
11M-YQyYRK2wcriNAP2AEnr7eVLuUvNsh",https://drive.google.com/drive/folders/1uyJ7dY2AyTsypEKs5GvQnnHwoG3BbG_J,1uyJ7dY2AyTsypEKs5GvQnnHwoG3BbG_J,18,44,10,2025,23aec53e-8d04-40a8-b781-8196f5db99b6,cerrado,Roque,Roque,Roque,cerrado
10/28/2025 15:56:32,2025-10-28,15:50,AM,Lynwood,Wilian Aguilar,80,100,100,100,100,87,100,95,Tomar temperatura al abrir el restaurante .,"{""bitacoras"":{""items"":{""i2"":{""score"":60,""label"":""Bitácora de temperaturas al día""},""i3"":{""score"":100,""label"":""Registros de limpieza firmados""},""i1"":{""score"":100,""label"":""Checklist apertura/cierre completo""}},""score"":87},""alimentos"":{""items"":{""i4"":{""label"":""Stickers correctos donde aplica"",""score"":100},""i2"":{""label"":""Quesadillas bien calientes, sin quemar"",""score"":100},""i1"":{""label"":""Respeta porciones estándar (cucharas)"",""score"":100},""i3"":{""score"":100,""label"":""Burritos bien enrollados, sin dorar de más""}},""score"":100},""limpieza"":{""score"":100,""items"":{""i4"":{""label"":""Exterior y basureros limpios"",""score"":100},""i1"":{""score"":100,""label"":""Cubetas rojas con sanitizer tibio""},""i3"":{""score"":100,""label"":""Baños con insumos completos y sin olores""},""i2"":{""label"":""Plancha limpia y sin residuos"",""score"":100}}},""carnes"":{""items"":{""i2"":{""score"":100,""label"":""Utensilios limpios, no golpear espátulas""},""i3"":{""label"":""Escurre carnes y rota producto (FIFO)"",""score"":100},""i1"":{""score"":100,""label"":""Controla temperatura (450°/300°) y tiempos""},""i4"":{""label"":""Vigila cebolla asada y porciones"",""score"":100}},""score"":100},""tortillas"":{""items"":{""i3"":{""score"":100,""label"":""Reponer a tiempo y mantener frescura""},""i2"":{""label"":""Máx 5 tacos por plato (presentación)"",""score"":100},""i1"":{""score"":100,""label"":""Tortillas bien calientes (aceite solo en orillas)""}},""score"":100},""servicio"":{""score"":80,""items"":{""i4"":{""score"":60,""label"":""Evita charlas personales en línea""},""i2"":{""label"":""Atiende con paciencia y respeto"",""score"":100},""i1"":{""score"":100,""label"":""Saluda y despide cordialmente""},""i3"":{""label"":""Entrega órdenes con frase de cierre"",""score"":60}}},""aseo"":{""score"":100,""items"":{""i3"":{""label"":""Uso correcto de gorra y guantes"",""score"":100},""i1"":{""score"":100,""label"":""Uniforme limpio y completo""},""i2"":{""label"":""Uñas cortas, sin joyas/auriculares"",""score"":100}}}}","https://drive.google.com/file/d/1QX4bDFQD1FnqMoi35NQXbAbSvM-8JboR/view?usp=drivesdk
https://drive.google.com/file/d/1f5IrSEss9gJuIkjEU3Ytvw5HA5YhBcII/view?usp=drivesdk
https://drive.google.com/file/d/12VVO9rXHQKZtF_0ZmaV6gQJ9qD4UZQ_8/view?usp=drivesdk
https://drive.google.com/file/d/1x_04EjZ8TBSPM0oPkq2n6Qn_822pi0Fy/view?usp=drivesdk
https://drive.google.com/file/d/1dkp0X_UtElGlX9jsDfgOgXcWhIdnR3t6/view?usp=drivesdk
https://drive.google.com/file/d/1fgQ-5ha38fyRJLUySvBFJOtg03QVIVuA/view?usp=drivesdk","1QX4bDFQD1FnqMoi35NQXbAbSvM-8JboR
1f5IrSEss9gJuIkjEU3Ytvw5HA5YhBcII
12VVO9rXHQKZtF_0ZmaV6gQJ9qD4UZQ_8
1x_04EjZ8TBSPM0oPkq2n6Qn_822pi0Fy
1dkp0X_UtElGlX9jsDfgOgXcWhIdnR3t6
1fgQ-5ha38fyRJLUySvBFJOtg03QVIVuA",https://drive.google.com/drive/folders/1zjUtryp3hYgrugIQKP2PzPww21V8kiJL,1zjUtryp3hYgrugIQKP2PzPww21V8kiJL,19,44,10,2025,c48f9fe1-b547-4d3a-ad44-64ad552c33ae,cerrado,Roque,Roque,Roque,cerrado
10/28/2025 16:49:37,2025-10-28,16:45,AM,Lynwood,Wilian Aguilar,90,90,100,100,100,100,100,97,"1-Mejorar la atencion de entrega de ordenes online 

2- limpieza parede roja logo Gavilan","{""tortillas"":{""items"":{""i3"":{""score"":100,""label"":""Reponer a tiempo y mantener frescura""},""i1"":{""label"":""Tortillas bien calientes (aceite solo en orillas)"",""score"":100},""i2"":{""label"":""Máx 5 tacos por plato (presentación)"",""score"":100}},""score"":100},""carnes"":{""score"":90,""items"":{""i2"":{""score"":100,""label"":""Utensilios limpios, no golpear espátulas""},""i4"":{""label"":""Vigila cebolla asada y porciones"",""score"":100},""i1"":{""score"":100,""label"":""Controla temperatura (450°/300°) y tiempos""},""i3"":{""label"":""Escurre carnes y rota producto (FIFO)"",""score"":60}}},""servicio"":{""items"":{""i4"":{""label"":""Evita charlas personales en línea"",""score"":100},""i2"":{""score"":100,""label"":""Atiende con paciencia y respeto""},""i3"":{""label"":""Entrega órdenes con frase de cierre"",""score"":60},""i1"":{""score"":100,""label"":""Saluda y despide cordialmente""}},""score"":90},""bitacoras"":{""items"":{""i2"":{""label"":""Bitácora de temperaturas al día"",""score"":100},""i1"":{""label"":""Checklist apertura/cierre completo"",""score"":100},""i3"":{""score"":100,""label"":""Registros de limpieza firmados""}},""score"":100},""aseo"":{""items"":{""i2"":{""label"":""Uñas cortas, sin joyas/auriculares"",""score"":100},""i3"":{""score"":100,""label"":""Uso correcto de gorra y guantes""},""i1"":{""score"":100,""label"":""Uniforme limpio y completo""}},""score"":100},""limpieza"":{""score"":100,""items"":{""i1"":{""label"":""Cubetas rojas con sanitizer tibio"",""score"":100},""i3"":{""score"":100,""label"":""Baños con insumos completos y sin olores""},""i4"":{""score"":100,""label"":""Exterior y basureros limpios""},""i2"":{""label"":""Plancha limpia y sin residuos"",""score"":100}}},""alimentos"":{""score"":100,""items"":{""i3"":{""score"":100,""label"":""Burritos bien enrollados, sin dorar de más""},""i1"":{""label"":""Respeta porciones estándar (cucharas)"",""score"":100},""i4"":{""label"":""Stickers correctos donde aplica"",""score"":100},""i2"":{""score"":100,""label"":""Quesadillas bien calientes, sin quemar""}}}}","https://drive.google.com/file/d/1xWy79W0oEebaZ6Ku9Icq_RYHMuMEWTZf/view?usp=drivesdk
https://drive.google.com/file/d/1gI7NgXEntOYTKOy23HDrqh0-ALtoAZ15/view?usp=drivesdk
https://drive.google.com/file/d/1oiyEwn61nDX3WmCmF_giwxfsWttxtZtP/view?usp=drivesdk
https://drive.google.com/file/d/1DUTzsD2O_b5Q9rEIhUXxmJUqEWGUI6gW/view?usp=drivesdk
https://drive.google.com/file/d/1Uqdnq_bC1oSit5m7fnn94dNvxg_Otyoc/view?usp=drivesdk","1xWy79W0oEebaZ6Ku9Icq_RYHMuMEWTZf
1gI7NgXEntOYTKOy23HDrqh0-ALtoAZ15
1oiyEwn61nDX3WmCmF_giwxfsWttxtZtP
1DUTzsD2O_b5Q9rEIhUXxmJUqEWGUI6gW
1Uqdnq_bC1oSit5m7fnn94dNvxg_Otyoc",https://drive.google.com/drive/folders/1zjUtryp3hYgrugIQKP2PzPww21V8kiJL,1zjUtryp3hYgrugIQKP2PzPww21V8kiJL,21,44,10,2025,44d44b2e-0051-4034-9f42-bb6c55e62251,cerrado,Roque,Roque,Roque,cerrado
10/29/2025 16:14:02,2025-10-29,16:10,AM,Downey,Wilian Aguilar,80,100,100,100,90,100,100,96,Linpiar base tambo del aceite,"{""bitacoras"":{""score"":100,""items"":{""i2"":{""score"":100,""label"":""Bitácora de temperaturas al día""},""i3"":{""label"":""Registros de limpieza firmados"",""score"":100},""i1"":{""label"":""Checklist apertura/cierre completo"",""score"":100}}},""servicio"":{""items"":{""i4"":{""label"":""Evita charlas personales en línea"",""score"":60},""i3"":{""score"":60,""label"":""Entrega órdenes con frase de cierre""},""i1"":{""score"":100,""label"":""Saluda y despide cordialmente""},""i2"":{""score"":100,""label"":""Atiende con paciencia y respeto""}},""score"":80},""tortillas"":{""score"":100,""items"":{""i3"":{""score"":100,""label"":""Reponer a tiempo y mantener frescura""},""i1"":{""label"":""Tortillas bien calientes (aceite solo en orillas)"",""score"":100},""i2"":{""label"":""Máx 5 tacos por plato (presentación)"",""score"":100}}},""carnes"":{""score"":100,""items"":{""i2"":{""score"":100,""label"":""Utensilios limpios, no golpear espátulas""},""i4"":{""label"":""Vigila cebolla asada y porciones"",""score"":100},""i1"":{""score"":100,""label"":""Controla temperatura (450°/300°) y tiempos""},""i3"":{""score"":100,""label"":""Escurre carnes y rota producto (FIFO)""}}},""alimentos"":{""items"":{""i2"":{""label"":""Quesadillas bien calientes, sin quemar"",""score"":100},""i3"":{""label"":""Burritos bien enrollados, sin dorar de más"",""score"":100},""i4"":{""score"":100,""label"":""Stickers correctos donde aplica""},""i1"":{""score"":100,""label"":""Respeta porciones estándar (cucharas)""}},""score"":100},""limpieza"":{""score"":90,""items"":{""i4"":{""score"":100,""label"":""Exterior y basureros limpios""},""i3"":{""label"":""Baños con insumos completos y sin olores"",""score"":100},""i1"":{""label"":""Cubetas rojas con sanitizer tibio"",""score"":100},""i2"":{""label"":""Plancha limpia y sin residuos"",""score"":60}}},""aseo"":{""score"":100,""items"":{""i3"":{""score"":0,""label"":""Uso correcto de gorra y guantes""},""i2"":{""score"":100,""label"":""Uñas cortas, sin joyas/auriculares""},""i1"":{""label"":""Uniforme limpio y completo"",""score"":100}}}}","https://drive.google.com/file/d/1vZJv-4xxEZiQUYOTRYQ2Xp6j2J4FsJaS/view?usp=drivesdk
https://drive.google.com/file/d/1WiYvepJfa-nKnzx3H149-ySPq9QMtLmJ/view?usp=drivesdk
https://drive.google.com/file/d/1yFGXJA_SrlUNMu262r5eZJ8uEbCHH02M/view?usp=drivesdk
https://drive.google.com/file/d/1J7QHRFO58ULUaC5tMj-qPDhdwF1zEMGP/view?usp=drivesdk
https://drive.google.com/file/d/1bYm3DxmgPITFPlOEl1h9ibcMaBBUPSrd/view?usp=drivesdk","1vZJv-4xxEZiQUYOTRYQ2Xp6j2J4FsJaS
1WiYvepJfa-nKnzx3H149-ySPq9QMtLmJ
1yFGXJA_SrlUNMu262r5eZJ8uEbCHH02M
1J7QHRFO58ULUaC5tMj-qPDhdwF1zEMGP
1bYm3DxmgPITFPlOEl1h9ibcMaBBUPSrd",https://drive.google.com/drive/folders/1-DbJxYhyb0zWTVS-Uo0YlMd5H2I6O_Ro,1-DbJxYhyb0zWTVS-Uo0YlMd5H2I6O_Ro,22,44,10,2025,c0dbfd84-fdef-4f30-9d44-3357b93d681a,cerrado,Roque,Roque,Roque,cerrado
10/29/2025 19:32:08,2025-10-29,18:34,PM,South Gate,Wilian Aguilar,90,100,100,100,90,100,100,97,,"{""carnes"":{""items"":{""i1"":{""label"":""Controla temperatura (450°/300°) y tiempos"",""score"":100},""i4"":{""label"":""Vigila cebolla asada y porciones"",""score"":100},""i2"":{""score"":100,""label"":""Utensilios limpios, no golpear espátulas""},""i3"":{""score"":100,""label"":""Escurre carnes y rota producto (FIFO)""}},""score"":100},""alimentos"":{""score"":100,""items"":{""i1"":{""label"":""Respeta porciones estándar (cucharas)"",""score"":100},""i2"":{""label"":""Quesadillas bien calientes, sin quemar"",""score"":100},""i3"":{""label"":""Burritos bien enrollados, sin dorar de más"",""score"":100},""i4"":{""label"":""Stickers correctos donde aplica"",""score"":100}}},""limpieza"":{""score"":90,""items"":{""i2"":{""score"":60,""label"":""Plancha limpia y sin residuos""},""i1"":{""label"":""Cubetas rojas con sanitizer tibio"",""score"":100},""i3"":{""label"":""Baños con insumos completos y sin olores"",""score"":100},""i4"":{""label"":""Exterior y basureros limpios"",""score"":100}}},""tortillas"":{""score"":100,""items"":{""i1"":{""score"":100,""label"":""Tortillas bien calientes (aceite solo en orillas)""},""i3"":{""score"":100,""label"":""Reponer a tiempo y mantener frescura""},""i2"":{""label"":""Máx 5 tacos por plato (presentación)"",""score"":100}}},""aseo"":{""items"":{""i1"":{""label"":""Uniforme limpio y completo"",""score"":100},""i3"":{""label"":""Uso correcto de gorra y guantes"",""score"":100},""i2"":{""score"":100,""label"":""Uñas cortas, sin joyas/auriculares""}},""score"":100},""bitacoras"":{""items"":{""i2"":{""label"":""Bitácora de temperaturas al día"",""score"":100},""i3"":{""score"":100,""label"":""Registros de limpieza firmados""},""i1"":{""score"":100,""label"":""Checklist apertura/cierre completo""}},""score"":100},""servicio"":{""score"":90,""items"":{""i3"":{""label"":""Entrega órdenes con frase de cierre"",""score"":100},""i4"":{""label"":""Evita charlas personales en línea"",""score"":60},""i2"":{""label"":""Atiende con paciencia y respeto"",""score"":100},""i1"":{""score"":100,""label"":""Saluda y despide cordialmente""}}}}",,,https://drive.google.com/drive/folders/1DWmLbtz_krp4vj5xTn8rvtDkUs3uqMQw,1DWmLbtz_krp4vj5xTn8rvtDkUs3uqMQw,23,44,10,2025,044a1cb0-d9b6-4873-ad05-839dad160d3e,cerrado,Roque,Roque,Roque,cerrado
10/31/2025 15:48:49,2025-10-31,15:34,AM,Lynwood,Wilian Aguilar,80,100,100,100,100,100,100,97,1-La Frase para entregar la orden no se esta cumpliendo.,"{""tortillas"":{""items"":{""i3"":{""score"":100,""label"":""Reponer a tiempo y mantener frescura""},""i2"":{""score"":100,""label"":""Máx 5 tacos por plato (presentación)""},""i1"":{""label"":""Tortillas bien calientes (aceite solo en orillas)"",""score"":100}},""score"":100},""aseo"":{""score"":100,""items"":{""i3"":{""score"":100,""label"":""Uso correcto de gorra y guantes""},""i2"":{""score"":100,""label"":""Uñas cortas, sin joyas/auriculares""},""i1"":{""label"":""Uniforme limpio y completo"",""score"":100}}},""alimentos"":{""items"":{""i4"":{""score"":100,""label"":""Stickers correctos donde aplica""},""i3"":{""score"":100,""label"":""Burritos bien enrollados, sin dorar de más""},""i1"":{""label"":""Respeta porciones estándar (cucharas)"",""score"":100},""i2"":{""score"":100,""label"":""Quesadillas bien calientes, sin quemar""}},""score"":100},""bitacoras"":{""items"":{""i2"":{""label"":""Bitácora de temperaturas al día"",""score"":100},""i1"":{""score"":100,""label"":""Checklist apertura/cierre completo""},""i3"":{""label"":""Registros de limpieza firmados"",""score"":100}},""score"":100},""servicio"":{""items"":{""i2"":{""label"":""Atiende con paciencia y respeto"",""score"":100},""i4"":{""label"":""Evita charlas personales en línea"",""score"":60},""i3"":{""label"":""Entrega órdenes con frase de cierre"",""score"":60},""i1"":{""label"":""Saluda y despide cordialmente"",""score"":100}},""score"":80},""limpieza"":{""items"":{""i4"":{""label"":""Exterior y basureros limpios"",""score"":100},""i1"":{""score"":100,""label"":""Cubetas rojas con sanitizer tibio""},""i2"":{""score"":100,""label"":""Plancha limpia y sin residuos""},""i3"":{""label"":""Baños con insumos completos y sin olores"",""score"":100}},""score"":100},""carnes"":{""score"":100,""items"":{""i3"":{""score"":100,""label"":""Escurre carnes y rota producto (FIFO)""},""i1"":{""score"":100,""label"":""Controla temperatura (450°/300°) y tiempos""},""i4"":{""label"":""Vigila cebolla asada y porciones"",""score"":100},""i2"":{""label"":""Utensilios limpios, no golpear espátulas"",""score"":100}}}}",,,https://drive.google.com/drive/folders/1s6nM21yjAOx06FByasD1s70Fm_60M3l7,1s6nM21yjAOx06FByasD1s70Fm_60M3l7,6,44,10,2025,ad559ec0-5c70-4961-8dae-720cb23c7eb0,cerrado,Roque,Roque,Roque,cerrado
10/31/2025 19:35:36,2025-10-31,19:29,PM,Downey,Wilian Aguilar,90,100,100,100,100,100,100,99,1- encontre muy limpio .,"{""aseo"":{""score"":100,""items"":{""i1"":{""score"":100,""label"":""Uniforme limpio y completo""},""i3"":{""label"":""Uso correcto de gorra y guantes"",""score"":100},""i2"":{""score"":100,""label"":""Uñas cortas, sin joyas/auriculares""}}},""servicio"":{""score"":90,""items"":{""i1"":{""label"":""Saluda y despide cordialmente"",""score"":100},""i3"":{""label"":""Entrega órdenes con frase de cierre"",""score"":100},""i2"":{""score"":100,""label"":""Atiende con paciencia y respeto""},""i4"":{""label"":""Evita charlas personales en línea"",""score"":60}}},""alimentos"":{""items"":{""i1"":{""score"":100,""label"":""Respeta porciones estándar (cucharas)""},""i4"":{""label"":""Stickers correctos donde aplica"",""score"":100},""i2"":{""score"":100,""label"":""Quesadillas bien calientes, sin quemar""},""i3"":{""label"":""Burritos bien enrollados, sin dorar de más"",""score"":100}},""score"":100},""bitacoras"":{""items"":{""i1"":{""label"":""Checklist apertura/cierre completo"",""score"":100},""i3"":{""label"":""Registros de limpieza firmados"",""score"":100},""i2"":{""label"":""Bitácora de temperaturas al día"",""score"":100}},""score"":100},""carnes"":{""items"":{""i1"":{""label"":""Controla temperatura (450°/300°) y tiempos"",""score"":100},""i2"":{""score"":100,""label"":""Utensilios limpios, no golpear espátulas""},""i3"":{""score"":100,""label"":""Escurre carnes y rota producto (FIFO)""},""i4"":{""label"":""Vigila cebolla asada y porciones"",""score"":100}},""score"":100},""limpieza"":{""score"":100,""items"":{""i3"":{""label"":""Baños con insumos completos y sin olores"",""score"":100},""i1"":{""label"":""Cubetas rojas con sanitizer tibio"",""score"":100},""i2"":{""label"":""Plancha limpia y sin residuos"",""score"":100},""i4"":{""label"":""Exterior y basureros limpios"",""score"":100}}},""tortillas"":{""score"":100,""items"":{""i2"":{""score"":100,""label"":""Máx 5 tacos por plato (presentación)""},""i3"":{""score"":100,""label"":""Reponer a tiempo y mantener frescura""},""i1"":{""score"":100,""label"":""Tortillas bien calientes (aceite solo en orillas)""}}}}",,,https://drive.google.com/drive/folders/1ENg97fTGhm1iOXTywN_4leK6WJGvKH2G,1ENg97fTGhm1iOXTywN_4leK6WJGvKH2G,7,44,10,2025,1f5a26c3-9697-4e66-83fb-8634168af8fd,cerrado,Roque,Roque,Roque,cerrado
10/31/2025 21:10:50,2025-10-31,21:04,PM,South Gate,Wilian Aguilar,80,100,100,100,100,100,100,97,1 seguir el procedimiento preparacion y envolver tortas,"{""aseo"":{""items"":{""i2"":{""score"":100,""label"":""Uñas cortas, sin joyas/auriculares""},""i3"":{""score"":100,""label"":""Uso correcto de gorra y guantes""},""i1"":{""label"":""Uniforme limpio y completo"",""score"":100}},""score"":100},""carnes"":{""score"":100,""items"":{""i4"":{""label"":""Vigila cebolla asada y porciones"",""score"":100},""i1"":{""label"":""Controla temperatura (450°/300°) y tiempos"",""score"":100},""i2"":{""score"":100,""label"":""Utensilios limpios, no golpear espátulas""},""i3"":{""label"":""Escurre carnes y rota producto (FIFO)"",""score"":100}}},""servicio"":{""score"":80,""items"":{""i4"":{""score"":60,""label"":""Evita charlas personales en línea""},""i3"":{""score"":60,""label"":""Entrega órdenes con frase de cierre""},""i1"":{""score"":100,""label"":""Saluda y despide cordialmente""},""i2"":{""label"":""Atiende con paciencia y respeto"",""score"":100}}},""bitacoras"":{""items"":{""i2"":{""label"":""Bitácora de temperaturas al día"",""score"":100},""i1"":{""score"":100,""label"":""Checklist apertura/cierre completo""},""i3"":{""score"":100,""label"":""Registros de limpieza firmados""}},""score"":100},""tortillas"":{""items"":{""i2"":{""label"":""Máx 5 tacos por plato (presentación)"",""score"":100},""i1"":{""label"":""Tortillas bien calientes (aceite solo en orillas)"",""score"":100},""i3"":{""label"":""Reponer a tiempo y mantener frescura"",""score"":100}},""score"":100},""alimentos"":{""items"":{""i2"":{""score"":100,""label"":""Quesadillas bien calientes, sin quemar""},""i1"":{""score"":100,""label"":""Respeta porciones estándar (cucharas)""},""i4"":{""label"":""Stickers correctos donde aplica"",""score"":100},""i3"":{""score"":100,""label"":""Burritos bien enrollados, sin dorar de más""}},""score"":100},""limpieza"":{""score"":100,""items"":{""i4"":{""label"":""Exterior y basureros limpios"",""score"":100},""i2"":{""label"":""Plancha limpia y sin residuos"",""score"":100},""i1"":{""label"":""Cubetas rojas con sanitizer tibio"",""score"":100},""i3"":{""label"":""Baños con insumos completos y sin olores"",""score"":100}}}}",https://drive.google.com/file/d/1n4e5F2Hx-maUMVi9HSW3IAwHOKl0vwNK/view?usp=drivesdk,1n4e5F2Hx-maUMVi9HSW3IAwHOKl0vwNK,https://drive.google.com/drive/folders/1LPl_vHe0iIWaV44l0_KEFkAPjmHC2kWr,1LPl_vHe0iIWaV44l0_KEFkAPjmHC2kWr,8,44,10,2025,e1995adf-0c1e-4f50-acbc-7dbe2c1e6a77,cerrado,Roque,Roque,Roque,cerrado
10/31/2025 22:16:51,2025-10-31,22:08,PM,Bell,Wilian Aguilar,87,100,100,100,90,73,100,93,"1- no se habia tomado temperatura frio ni caliente 
2- Limpieza del baño hombres de clientes no se habia revisado","{""carnes"":{""score"":100,""items"":{""i2"":{""score"":100,""label"":""Utensilios limpios, no golpear espátulas""},""i3"":{""score"":100,""label"":""Escurre carnes y rota producto (FIFO)""},""i1"":{""label"":""Controla temperatura (450°/300°) y tiempos"",""score"":100},""i4"":{""score"":100,""label"":""Vigila cebolla asada y porciones""}}},""alimentos"":{""items"":{""i3"":{""score"":100,""label"":""Burritos bien enrollados, sin dorar de más""},""i4"":{""score"":100,""label"":""Stickers correctos donde aplica""},""i1"":{""label"":""Respeta porciones estándar (cucharas)"",""score"":100},""i2"":{""score"":100,""label"":""Quesadillas bien calientes, sin quemar""}},""score"":100},""bitacoras"":{""score"":73,""items"":{""i2"":{""label"":""Bitácora de temperaturas al día"",""score"":60},""i1"":{""label"":""Checklist apertura/cierre completo"",""score"":100},""i3"":{""label"":""Registros de limpieza firmados"",""score"":60}}},""limpieza"":{""items"":{""i2"":{""label"":""Plancha limpia y sin residuos"",""score"":100},""i1"":{""label"":""Cubetas rojas con sanitizer tibio"",""score"":100},""i4"":{""score"":100,""label"":""Exterior y basureros limpios""},""i3"":{""label"":""Baños con insumos completos y sin olores"",""score"":60}},""score"":90},""servicio"":{""items"":{""i2"":{""score"":100,""label"":""Atiende con paciencia y respeto""},""i4"":{""label"":""Evita charlas personales en línea"",""score"":0},""i1"":{""score"":100,""label"":""Saluda y despide cordialmente""},""i3"":{""score"":60,""label"":""Entrega órdenes con frase de cierre""}},""score"":87},""tortillas"":{""items"":{""i2"":{""score"":100,""label"":""Máx 5 tacos por plato (presentación)""},""i1"":{""score"":100,""label"":""Tortillas bien calientes (aceite solo en orillas)""},""i3"":{""label"":""Reponer a tiempo y mantener frescura"",""score"":100}},""score"":100},""aseo"":{""items"":{""i3"":{""score"":100,""label"":""Uso correcto de gorra y guantes""},""i1"":{""label"":""Uniforme limpio y completo"",""score"":100},""i2"":{""score"":100,""label"":""Uñas cortas, sin joyas/auriculares""}},""score"":100}}","https://drive.google.com/file/d/1FrbNvaaxq7x4iTZFZ10h5DFSS_QUQF_z/view?usp=drivesdk
https://drive.google.com/file/d/1YIaXOXR0KK07qtIrmEt2Tp6qyzyIJFZ-/view?usp=drivesdk
https://drive.google.com/file/d/1qHh15RjgkrOwn7pDoeRZDGdZWGJZLVLo/view?usp=drivesdk","1FrbNvaaxq7x4iTZFZ10h5DFSS_QUQF_z
1YIaXOXR0KK07qtIrmEt2Tp6qyzyIJFZ-
1qHh15RjgkrOwn7pDoeRZDGdZWGJZLVLo",https://drive.google.com/drive/folders/1KTX8Gba1Sq_azpM1dE4Hvol0q71q4KCY,1KTX8Gba1Sq_azpM1dE4Hvol0q71q4KCY,9,44,10,2025,63a5514e-bd85-4770-8113-154b83a671b0,cerrado,Roque,Roque,Roque,cerrado
11/1/2025 19:02:14,2025-11-01,18:57,PM,South Gate,Wilian Aguilar,100,100,100,100,100,87,100,98,1- no encontre la temperatura revisada .,"{""aseo"":{""items"":{""i3"":{""label"":""Uso correcto de gorra y guantes"",""score"":100},""i2"":{""label"":""Uñas cortas, sin joyas/auriculares"",""score"":100},""i1"":{""score"":100,""label"":""Uniforme limpio y completo""}},""score"":100},""servicio"":{""items"":{""i3"":{""label"":""Entrega órdenes con frase de cierre"",""score"":100},""i4"":{""score"":100,""label"":""Evita charlas personales en línea""},""i2"":{""score"":100,""label"":""Atiende con paciencia y respeto""},""i1"":{""score"":100,""label"":""Saluda y despide cordialmente""}},""score"":100},""alimentos"":{""score"":100,""items"":{""i4"":{""score"":100,""label"":""Stickers correctos donde aplica""},""i3"":{""label"":""Burritos bien enrollados, sin dorar de más"",""score"":100},""i2"":{""label"":""Quesadillas bien calientes, sin quemar"",""score"":100},""i1"":{""label"":""Respeta porciones estándar (cucharas)"",""score"":100}}},""carnes"":{""items"":{""i3"":{""score"":100,""label"":""Escurre carnes y rota producto (FIFO)""},""i1"":{""score"":100,""label"":""Controla temperatura (450°/300°) y tiempos""},""i2"":{""score"":100,""label"":""Utensilios limpios, no golpear espátulas""},""i4"":{""score"":100,""label"":""Vigila cebolla asada y porciones""}},""score"":100},""bitacoras"":{""score"":87,""items"":{""i2"":{""score"":60,""label"":""Bitácora de temperaturas al día""},""i3"":{""score"":100,""label"":""Registros de limpieza firmados""},""i1"":{""label"":""Checklist apertura/cierre completo"",""score"":100}}},""tortillas"":{""score"":100,""items"":{""i1"":{""score"":100,""label"":""Tortillas bien calientes (aceite solo en orillas)""},""i2"":{""label"":""Máx 5 tacos por plato (presentación)"",""score"":100},""i3"":{""score"":100,""label"":""Reponer a tiempo y mantener frescura""}}},""limpieza"":{""items"":{""i3"":{""label"":""Baños con insumos completos y sin olores"",""score"":100},""i4"":{""label"":""Exterior y basureros limpios"",""score"":100},""i2"":{""label"":""Plancha limpia y sin residuos"",""score"":100},""i1"":{""label"":""Cubetas rojas con sanitizer tibio"",""score"":100}},""score"":100}}",https://drive.google.com/file/d/1TI1_NMhWTT_jbZq8mwZ0DcPCp-JFT45P/view?usp=drivesdk,1TI1_NMhWTT_jbZq8mwZ0DcPCp-JFT45P,https://drive.google.com/drive/folders/1gws8qtcD4xB-dQ7sTujUitGjrYufMVUj,1gws8qtcD4xB-dQ7sTujUitGjrYufMVUj,10,44,11,2025,1730c5dc-6f87-44de-9a61-80590a003c7d,cerrado,Roque,Roque,Roque,cerrado
11/1/2025 20:37:20,2025-11-01,20:20,PM,Downey,Wilian Aguilar,90,100,100,100,100,100,100,99,"1- no se esta siguiente la entrega de cierre decir Ya esta su orden.

2 mantener el bote del aceite tapado siempre.","{""limpieza"":{""score"":100,""items"":{""i3"":{""label"":""Baños con insumos completos y sin olores"",""score"":100},""i4"":{""label"":""Exterior y basureros limpios"",""score"":100},""i1"":{""label"":""Cubetas rojas con sanitizer tibio"",""score"":100},""i2"":{""label"":""Plancha limpia y sin residuos"",""score"":100}}},""carnes"":{""items"":{""i2"":{""score"":100,""label"":""Utensilios limpios, no golpear espátulas""},""i1"":{""label"":""Controla temperatura (450°/300°) y tiempos"",""score"":100},""i3"":{""score"":100,""label"":""Escurre carnes y rota producto (FIFO)""},""i4"":{""score"":100,""label"":""Vigila cebolla asada y porciones""}},""score"":100},""aseo"":{""items"":{""i1"":{""score"":100,""label"":""Uniforme limpio y completo""},""i3"":{""score"":100,""label"":""Uso correcto de gorra y guantes""},""i2"":{""score"":100,""label"":""Uñas cortas, sin joyas/auriculares""}},""score"":100},""tortillas"":{""items"":{""i3"":{""score"":100,""label"":""Reponer a tiempo y mantener frescura""},""i2"":{""score"":100,""label"":""Máx 5 tacos por plato (presentación)""},""i1"":{""label"":""Tortillas bien calientes (aceite solo en orillas)"",""score"":100}},""score"":100},""servicio"":{""score"":90,""items"":{""i2"":{""label"":""Atiende con paciencia y respeto"",""score"":100},""i3"":{""score"":60,""label"":""Entrega órdenes con frase de cierre""},""i1"":{""label"":""Saluda y despide cordialmente"",""score"":100},""i4"":{""label"":""Evita charlas personales en línea"",""score"":100}}},""alimentos"":{""score"":100,""items"":{""i2"":{""label"":""Quesadillas bien calientes, sin quemar"",""score"":100},""i1"":{""score"":100,""label"":""Respeta porciones estándar (cucharas)""},""i4"":{""score"":100,""label"":""Stickers correctos donde aplica""},""i3"":{""label"":""Burritos bien enrollados, sin dorar de más"",""score"":100}}},""bitacoras"":{""items"":{""i1"":{""score"":100,""label"":""Checklist apertura/cierre completo""},""i2"":{""score"":100,""label"":""Bitácora de temperaturas al día""},""i3"":{""score"":100,""label"":""Registros de limpieza firmados""}},""score"":100}}",https://drive.google.com/file/d/1XZfgtMLAwKwgf-lQ93sEizaint1Lj9Xn/view?usp=drivesdk,1XZfgtMLAwKwgf-lQ93sEizaint1Lj9Xn,https://drive.google.com/drive/folders/1JZGXKjOHFfBU5yS_R0cFQMMJlOkPs0I6,1JZGXKjOHFfBU5yS_R0cFQMMJlOkPs0I6,11,44,11,2025,90445ab6-565f-4fa5-94ea-31b54afb99e9,cerrado,Roque,Roque,Roque,cerrado
11/1/2025 22:04:43,2025-11-01,21:51,PM,Lynwood,Wilian Aguilar,90,100,100,100,100,73,100,95,"1- no se esta tomando temperatura de lo frio y caliente esta incompleto.
2 checklist general incompleto.","{""aseo"":{""score"":100,""items"":{""i3"":{""score"":100,""label"":""Uso correcto de gorra y guantes""},""i1"":{""label"":""Uniforme limpio y completo"",""score"":100},""i2"":{""label"":""Uñas cortas, sin joyas/auriculares"",""score"":100}}},""limpieza"":{""score"":100,""items"":{""i3"":{""score"":100,""label"":""Baños con insumos completos y sin olores""},""i4"":{""label"":""Exterior y basureros limpios"",""score"":100},""i2"":{""score"":100,""label"":""Plancha limpia y sin residuos""},""i1"":{""score"":100,""label"":""Cubetas rojas con sanitizer tibio""}}},""tortillas"":{""items"":{""i1"":{""score"":100,""label"":""Tortillas bien calientes (aceite solo en orillas)""},""i2"":{""score"":100,""label"":""Máx 5 tacos por plato (presentación)""},""i3"":{""score"":100,""label"":""Reponer a tiempo y mantener frescura""}},""score"":100},""alimentos"":{""score"":100,""items"":{""i4"":{""label"":""Stickers correctos donde aplica"",""score"":100},""i2"":{""score"":100,""label"":""Quesadillas bien calientes, sin quemar""},""i1"":{""score"":100,""label"":""Respeta porciones estándar (cucharas)""},""i3"":{""score"":100,""label"":""Burritos bien enrollados, sin dorar de más""}}},""bitacoras"":{""items"":{""i2"":{""label"":""Bitácora de temperaturas al día"",""score"":60},""i3"":{""label"":""Registros de limpieza firmados"",""score"":100},""i1"":{""score"":60,""label"":""Checklist apertura/cierre completo""}},""score"":73},""servicio"":{""score"":90,""items"":{""i2"":{""label"":""Atiende con paciencia y respeto"",""score"":100},""i3"":{""label"":""Entrega órdenes con frase de cierre"",""score"":100},""i1"":{""label"":""Saluda y despide cordialmente"",""score"":100},""i4"":{""score"":60,""label"":""Evita charlas personales en línea""}}},""carnes"":{""score"":100,""items"":{""i3"":{""label"":""Escurre carnes y rota producto (FIFO)"",""score"":100},""i2"":{""label"":""Utensilios limpios, no golpear espátulas"",""score"":100},""i4"":{""label"":""Vigila cebolla asada y porciones"",""score"":100},""i1"":{""label"":""Controla temperatura (450°/300°) y tiempos"",""score"":100}}}}","https://drive.google.com/file/d/15cY7Jn4lSGMeAte0Uu6OAGbRP3gBTXg9/view?usp=drivesdk
https://drive.google.com/file/d/1itQ9l_bvlQNiBH-OcEO99LnxrX99ddoF/view?usp=drivesdk","15cY7Jn4lSGMeAte0Uu6OAGbRP3gBTXg9
1itQ9l_bvlQNiBH-OcEO99LnxrX99ddoF",https://drive.google.com/drive/folders/1UmVfVUykX_zxG2y-kGZ8FUooFDQdLawd,1UmVfVUykX_zxG2y-kGZ8FUooFDQdLawd,12,44,11,2025,9cceec0d-330f-4d23-8327-209d297a5660,cerrado,Roque,Roque,Roque,cerrado
11/2/2025 0:04:34,2025-11-01,23:47,PM,Bell,Wilian Aguilar,90,100,100,100,100,100,100,99,,"{""alimentos"":{""score"":100,""items"":{""i1"":{""label"":""Respeta porciones estándar (cucharas)"",""score"":100},""i4"":{""score"":100,""label"":""Stickers correctos donde aplica""},""i2"":{""score"":100,""label"":""Quesadillas bien calientes, sin quemar""},""i3"":{""score"":100,""label"":""Burritos bien enrollados, sin dorar de más""}}},""carnes"":{""items"":{""i2"":{""score"":100,""label"":""Utensilios limpios, no golpear espátulas""},""i4"":{""score"":100,""label"":""Vigila cebolla asada y porciones""},""i1"":{""score"":100,""label"":""Controla temperatura (450°/300°) y tiempos""},""i3"":{""score"":100,""label"":""Escurre carnes y rota producto (FIFO)""}},""score"":100},""limpieza"":{""items"":{""i2"":{""label"":""Plancha limpia y sin residuos"",""score"":100},""i1"":{""label"":""Cubetas rojas con sanitizer tibio"",""score"":100},""i4"":{""score"":100,""label"":""Exterior y basureros limpios""},""i3"":{""score"":100,""label"":""Baños con insumos completos y sin olores""}},""score"":100},""tortillas"":{""items"":{""i2"":{""label"":""Máx 5 tacos por plato (presentación)"",""score"":100},""i3"":{""score"":100,""label"":""Reponer a tiempo y mantener frescura""},""i1"":{""label"":""Tortillas bien calientes (aceite solo en orillas)"",""score"":100}},""score"":100},""aseo"":{""items"":{""i3"":{""score"":100,""label"":""Uso correcto de gorra y guantes""},""i2"":{""label"":""Uñas cortas, sin joyas/auriculares"",""score"":100},""i1"":{""score"":100,""label"":""Uniforme limpio y completo""}},""score"":100},""servicio"":{""score"":90,""items"":{""i2"":{""label"":""Atiende con paciencia y respeto"",""score"":100},""i4"":{""score"":60,""label"":""Evita charlas personales en línea""},""i3"":{""label"":""Entrega órdenes con frase de cierre"",""score"":100},""i1"":{""score"":100,""label"":""Saluda y despide cordialmente""}}},""bitacoras"":{""items"":{""i3"":{""label"":""Registros de limpieza firmados"",""score"":100},""i2"":{""score"":100,""label"":""Bitácora de temperaturas al día""},""i1"":{""label"":""Checklist apertura/cierre completo"",""score"":100}},""score"":100}}",,,https://drive.google.com/drive/folders/1q51qDZdJAX5vNDeM0mT3mrNQ095fefIi,1q51qDZdJAX5vNDeM0mT3mrNQ095fefIi,13,44,11,2025,c35aee11-ba86-491a-8222-1ebef2130014,cerrado,Roque,Roque,Roque,cerrado
11/2/2025 16:31:08,2025-11-02,16:26,AM,Lynwood,Wilian Aguilar,90,100,100,100,100,100,100,99,"1-Seguir con la frase de cierre ,ya esta su orden","{""servicio"":{""items"":{""i1"":{""score"":100,""label"":""Saluda y despide cordialmente""},""i4"":{""score"":100,""label"":""Evita charlas personales en línea""},""i2"":{""score"":100,""label"":""Atiende con paciencia y respeto""},""i3"":{""score"":60,""label"":""Entrega órdenes con frase de cierre""}},""score"":90},""carnes"":{""score"":100,""items"":{""i3"":{""label"":""Escurre carnes y rota producto (FIFO)"",""score"":100},""i2"":{""score"":100,""label"":""Utensilios limpios, no golpear espátulas""},""i4"":{""score"":100,""label"":""Vigila cebolla asada y porciones""},""i1"":{""label"":""Controla temperatura (450°/300°) y tiempos"",""score"":100}}},""bitacoras"":{""score"":100,""items"":{""i3"":{""score"":100,""label"":""Registros de limpieza firmados""},""i1"":{""label"":""Checklist apertura/cierre completo"",""score"":100},""i2"":{""score"":100,""label"":""Bitácora de temperaturas al día""}}},""limpieza"":{""items"":{""i4"":{""score"":100,""label"":""Exterior y basureros limpios""},""i2"":{""score"":100,""label"":""Plancha limpia y sin residuos""},""i1"":{""score"":100,""label"":""Cubetas rojas con sanitizer tibio""},""i3"":{""score"":100,""label"":""Baños con insumos completos y sin olores""}},""score"":100},""aseo"":{""score"":100,""items"":{""i1"":{""label"":""Uniforme limpio y completo"",""score"":100},""i3"":{""label"":""Uso correcto de gorra y guantes"",""score"":100},""i2"":{""score"":100,""label"":""Uñas cortas, sin joyas/auriculares""}}},""tortillas"":{""score"":100,""items"":{""i2"":{""label"":""Máx 5 tacos por plato (presentación)"",""score"":0},""i1"":{""score"":0,""label"":""Tortillas bien calientes (aceite solo en orillas)""},""i3"":{""label"":""Reponer a tiempo y mantener frescura"",""score"":100}}},""alimentos"":{""items"":{""i1"":{""score"":100,""label"":""Respeta porciones estándar (cucharas)""},""i4"":{""label"":""Stickers correctos donde aplica"",""score"":100},""i2"":{""label"":""Quesadillas bien calientes, sin quemar"",""score"":100},""i3"":{""label"":""Burritos bien enrollados, sin dorar de más"",""score"":100}},""score"":100}}",,,https://drive.google.com/drive/folders/1RF39yhXA2moNKbKT-kGq3YOn4PEiHUTe,1RF39yhXA2moNKbKT-kGq3YOn4PEiHUTe,14,45,11,2025,f2866bd9-9036-4fa1-a8c5-6719958638a1,cerrado,Roque,Roque,Roque,cerrado
11/2/2025 18:28:13,2025-11-02,18:24,PM,Bell,Wilian Aguilar,90,100,100,100,100,100,100,99,1- no se esta revisando el checklist de limpieza turno noche,"{""carnes"":{""items"":{""i2"":{""score"":100,""label"":""Utensilios limpios, no golpear espátulas""},""i3"":{""score"":100,""label"":""Escurre carnes y rota producto (FIFO)""},""i4"":{""score"":100,""label"":""Vigila cebolla asada y porciones""},""i1"":{""score"":100,""label"":""Controla temperatura (450°/300°) y tiempos""}},""score"":100},""bitacoras"":{""score"":100,""items"":{""i1"":{""label"":""Checklist apertura/cierre completo"",""score"":100},""i2"":{""score"":100,""label"":""Bitácora de temperaturas al día""},""i3"":{""score"":100,""label"":""Registros de limpieza firmados""}}},""tortillas"":{""score"":100,""items"":{""i2"":{""label"":""Máx 5 tacos por plato (presentación)"",""score"":100},""i1"":{""label"":""Tortillas bien calientes (aceite solo en orillas)"",""score"":100},""i3"":{""label"":""Reponer a tiempo y mantener frescura"",""score"":100}}},""alimentos"":{""items"":{""i2"":{""score"":100,""label"":""Quesadillas bien calientes, sin quemar""},""i3"":{""label"":""Burritos bien enrollados, sin dorar de más"",""score"":100},""i4"":{""score"":100,""label"":""Stickers correctos donde aplica""},""i1"":{""label"":""Respeta porciones estándar (cucharas)"",""score"":100}},""score"":100},""limpieza"":{""score"":100,""items"":{""i2"":{""label"":""Plancha limpia y sin residuos"",""score"":100},""i1"":{""score"":100,""label"":""Cubetas rojas con sanitizer tibio""},""i4"":{""label"":""Exterior y basureros limpios"",""score"":100},""i3"":{""score"":100,""label"":""Baños con insumos completos y sin olores""}}},""aseo"":{""items"":{""i1"":{""score"":100,""label"":""Uniforme limpio y completo""},""i3"":{""label"":""Uso correcto de gorra y guantes"",""score"":100},""i2"":{""score"":100,""label"":""Uñas cortas, sin joyas/auriculares""}},""score"":100},""servicio"":{""score"":90,""items"":{""i3"":{""label"":""Entrega órdenes con frase de cierre"",""score"":100},""i4"":{""label"":""Evita charlas personales en línea"",""score"":60},""i2"":{""score"":100,""label"":""Atiende con paciencia y respeto""},""i1"":{""label"":""Saluda y despide cordialmente"",""score"":100}}}}",https://drive.google.com/file/d/1MxbXjF-dsavcU0eN1X4y2xJD9MrSwYDE/view?usp=drivesdk,1MxbXjF-dsavcU0eN1X4y2xJD9MrSwYDE,https://drive.google.com/drive/folders/1jAmqRwldMJZgxMrUUeaEvOcgiwg9AGej,1jAmqRwldMJZgxMrUUeaEvOcgiwg9AGej,15,45,11,2025,db7cc600-a938-4b4f-a5bc-9f768fa06951,cerrado,Roque,Roque,Roque,cerrado
11/3/2025 11:42:21,2025-11-03,11:37,AM,Bell,Wilian Aguilar,90,90,100,100,100,100,100,97,1-mantener cebolla asada siempre la porcion correspondiente,"{""alimentos"":{""items"":{""i2"":{""label"":""Quesadillas bien calientes, sin quemar"",""score"":100},""i3"":{""label"":""Burritos bien enrollados, sin dorar de más"",""score"":100},""i1"":{""score"":100,""label"":""Respeta porciones estándar (cucharas)""},""i4"":{""label"":""Stickers correctos donde aplica"",""score"":100}},""score"":100},""servicio"":{""items"":{""i2"":{""score"":100,""label"":""Atiende con paciencia y respeto""},""i4"":{""score"":60,""label"":""Evita charlas personales en línea""},""i3"":{""score"":100,""label"":""Entrega órdenes con frase de cierre""},""i1"":{""score"":100,""label"":""Saluda y despide cordialmente""}},""score"":90},""carnes"":{""items"":{""i3"":{""label"":""Escurre carnes y rota producto (FIFO)"",""score"":100},""i1"":{""score"":100,""label"":""Controla temperatura (450°/300°) y tiempos""},""i2"":{""label"":""Utensilios limpios, no golpear espátulas"",""score"":100},""i4"":{""label"":""Vigila cebolla asada y porciones"",""score"":60}},""score"":90},""aseo"":{""score"":100,""items"":{""i1"":{""score"":100,""label"":""Uniforme limpio y completo""},""i2"":{""label"":""Uñas cortas, sin joyas/auriculares"",""score"":100},""i3"":{""score"":100,""label"":""Uso correcto de gorra y guantes""}}},""bitacoras"":{""score"":100,""items"":{""i3"":{""label"":""Registros de limpieza firmados"",""score"":100},""i2"":{""label"":""Bitácora de temperaturas al día"",""score"":100},""i1"":{""label"":""Checklist apertura/cierre completo"",""score"":100}}},""limpieza"":{""score"":100,""items"":{""i3"":{""label"":""Baños con insumos completos y sin olores"",""score"":100},""i4"":{""score"":100,""label"":""Exterior y basureros limpios""},""i2"":{""label"":""Plancha limpia y sin residuos"",""score"":100},""i1"":{""label"":""Cubetas rojas con sanitizer tibio"",""score"":100}}},""tortillas"":{""score"":100,""items"":{""i1"":{""score"":100,""label"":""Tortillas bien calientes (aceite solo en orillas)""},""i2"":{""label"":""Máx 5 tacos por plato (presentación)"",""score"":100},""i3"":{""label"":""Reponer a tiempo y mantener frescura"",""score"":100}}}}",https://drive.google.com/file/d/1SvqTxlO1qvBxs_aFPPtAIerEUKaUfTqK/view?usp=drivesdk,1SvqTxlO1qvBxs_aFPPtAIerEUKaUfTqK,https://drive.google.com/drive/folders/1RHbtKXbuPIkG_n1KJ70m4As0nZldPnEw,1RHbtKXbuPIkG_n1KJ70m4As0nZldPnEw,16,45,11,2025,9b2354a2-de28-4da7-b016-154cc7ad6a40,cerrado,Roque,Roque,Roque,cerrado
11/4/2025 13:33:04,2025-11-04,13:27,AM,Bell,Wilian Aguilar,100,90,100,100,100,87,100,97,"1- no encontre el registro de temperatura anotado .
2- Encontre la cebolla con jalapeños vacia","{""tortillas"":{""score"":100,""items"":{""i3"":{""label"":""Reponer a tiempo y mantener frescura"",""score"":100},""i1"":{""label"":""Tortillas bien calientes (aceite solo en orillas)"",""score"":100},""i2"":{""label"":""Máx 5 tacos por plato (presentación)"",""score"":100}}},""alimentos"":{""score"":100,""items"":{""i1"":{""label"":""Respeta porciones estándar (cucharas)"",""score"":100},""i3"":{""score"":100,""label"":""Burritos bien enrollados, sin dorar de más""},""i4"":{""score"":100,""label"":""Stickers correctos donde aplica""},""i2"":{""score"":0,""label"":""Quesadillas bien calientes, sin quemar""}}},""bitacoras"":{""items"":{""i3"":{""score"":100,""label"":""Registros de limpieza firmados""},""i1"":{""label"":""Checklist apertura/cierre completo"",""score"":100},""i2"":{""score"":60,""label"":""Bitácora de temperaturas al día""}},""score"":87},""carnes"":{""score"":90,""items"":{""i3"":{""label"":""Escurre carnes y rota producto (FIFO)"",""score"":100},""i4"":{""score"":60,""label"":""Vigila cebolla asada y porciones""},""i2"":{""label"":""Utensilios limpios, no golpear espátulas"",""score"":100},""i1"":{""score"":100,""label"":""Controla temperatura (450°/300°) y tiempos""}}},""limpieza"":{""items"":{""i3"":{""label"":""Baños con insumos completos y sin olores"",""score"":100},""i1"":{""score"":100,""label"":""Cubetas rojas con sanitizer tibio""},""i4"":{""score"":100,""label"":""Exterior y basureros limpios""},""i2"":{""score"":100,""label"":""Plancha limpia y sin residuos""}},""score"":100},""servicio"":{""items"":{""i1"":{""score"":100,""label"":""Saluda y despide cordialmente""},""i3"":{""label"":""Entrega órdenes con frase de cierre"",""score"":100},""i2"":{""label"":""Atiende con paciencia y respeto"",""score"":100},""i4"":{""score"":100,""label"":""Evita charlas personales en línea""}},""score"":100},""aseo"":{""score"":100,""items"":{""i3"":{""label"":""Uso correcto de gorra y guantes"",""score"":0},""i1"":{""label"":""Uniforme limpio y completo"",""score"":100},""i2"":{""score"":100,""label"":""Uñas cortas, sin joyas/auriculares""}}}}","https://drive.google.com/file/d/1rx2tLDL9hD2UvZ3RGDA5nHw69gyPGcWz/view?usp=drivesdk
https://drive.google.com/file/d/1O_lRzLwQ3Zt_z5A6jefDhisck8e0YaL_/view?usp=drivesdk","1rx2tLDL9hD2UvZ3RGDA5nHw69gyPGcWz
1O_lRzLwQ3Zt_z5A6jefDhisck8e0YaL_",https://drive.google.com/drive/folders/1_WEX564jFuMaCFfrNVeK70x3yCS5fj6T,1_WEX564jFuMaCFfrNVeK70x3yCS5fj6T,17,45,11,2025,502b8773-8093-48bd-88c2-97722091fb9d,cerrado,Roque,Roque,Roque,cerrado
11/4/2025 14:55:56,2025-11-04,14:44,AM,Lynwood,Wilian Aguilar,100,100,90,100,100,100,100,99,Encontre limpio.,"{""aseo"":{""items"":{""i1"":{""score"":100,""label"":""Uniforme limpio y completo""},""i2"":{""label"":""Uñas cortas, sin joyas/auriculares"",""score"":100},""i3"":{""label"":""Uso correcto de gorra y guantes"",""score"":100}},""score"":100},""alimentos"":{""items"":{""i3"":{""score"":60,""label"":""Burritos bien enrollados, sin dorar de más""},""i1"":{""score"":100,""label"":""Respeta porciones estándar (cucharas)""},""i2"":{""score"":100,""label"":""Quesadillas bien calientes, sin quemar""},""i4"":{""score"":100,""label"":""Stickers correctos donde aplica""}},""score"":90},""carnes"":{""score"":100,""items"":{""i1"":{""score"":100,""label"":""Controla temperatura (450°/300°) y tiempos""},""i4"":{""score"":100,""label"":""Vigila cebolla asada y porciones""},""i3"":{""score"":100,""label"":""Escurre carnes y rota producto (FIFO)""},""i2"":{""label"":""Utensilios limpios, no golpear espátulas"",""score"":100}}},""servicio"":{""items"":{""i3"":{""score"":100,""label"":""Entrega órdenes con frase de cierre""},""i4"":{""score"":100,""label"":""Evita charlas personales en línea""},""i1"":{""label"":""Saluda y despide cordialmente"",""score"":100},""i2"":{""score"":100,""label"":""Atiende con paciencia y respeto""}},""score"":100},""limpieza"":{""score"":100,""items"":{""i1"":{""score"":100,""label"":""Cubetas rojas con sanitizer tibio""},""i3"":{""score"":100,""label"":""Baños con insumos completos y sin olores""},""i4"":{""score"":100,""label"":""Exterior y basureros limpios""},""i2"":{""score"":100,""label"":""Plancha limpia y sin residuos""}}},""tortillas"":{""items"":{""i3"":{""label"":""Reponer a tiempo y mantener frescura"",""score"":100},""i2"":{""label"":""Máx 5 tacos por plato (presentación)"",""score"":100},""i1"":{""score"":100,""label"":""Tortillas bien calientes (aceite solo en orillas)""}},""score"":100},""bitacoras"":{""items"":{""i3"":{""score"":100,""label"":""Registros de limpieza firmados""},""i1"":{""label"":""Checklist apertura/cierre completo"",""score"":100},""i2"":{""label"":""Bitácora de temperaturas al día"",""score"":100}},""score"":100}}",https://drive.google.com/file/d/1btUzAJcgLop9u4JMa7QWwCX-FEEa0ioL/view?usp=drivesdk,1btUzAJcgLop9u4JMa7QWwCX-FEEa0ioL,https://drive.google.com/drive/folders/1mOL16z6xUI_qAxxfPNh23gO-Xai24FK7,1mOL16z6xUI_qAxxfPNh23gO-Xai24FK7,18,45,11,2025,1b623aa6-4f0f-4d4b-b4b8-a257eabe020f,cerrado,Roque,Roque,Roque,cerrado
11/4/2025 18:25:37,2025-11-04,18:19,PM,South Gate,Wilian Aguilar,90,100,100,100,100,100,100,99,"1 cuando se trapee el baño , se debe  de secar bien el piso para evitar un accidente, seguir el protocolo de limpieza y secar","{""servicio"":{""items"":{""i2"":{""score"":100,""label"":""Atiende con paciencia y respeto""},""i1"":{""score"":100,""label"":""Saluda y despide cordialmente""},""i3"":{""label"":""Entrega órdenes con frase de cierre"",""score"":100},""i4"":{""label"":""Evita charlas personales en línea"",""score"":60}},""score"":90},""tortillas"":{""score"":100,""items"":{""i1"":{""label"":""Tortillas bien calientes (aceite solo en orillas)"",""score"":100},""i3"":{""score"":100,""label"":""Reponer a tiempo y mantener frescura""},""i2"":{""label"":""Máx 5 tacos por plato (presentación)"",""score"":100}}},""alimentos"":{""score"":100,""items"":{""i2"":{""label"":""Quesadillas bien calientes, sin quemar"",""score"":100},""i3"":{""score"":100,""label"":""Burritos bien enrollados, sin dorar de más""},""i1"":{""score"":100,""label"":""Respeta porciones estándar (cucharas)""},""i4"":{""score"":100,""label"":""Stickers correctos donde aplica""}}},""carnes"":{""items"":{""i1"":{""score"":100,""label"":""Controla temperatura (450°/300°) y tiempos""},""i2"":{""label"":""Utensilios limpios, no golpear espátulas"",""score"":100},""i4"":{""label"":""Vigila cebolla asada y porciones"",""score"":100},""i3"":{""label"":""Escurre carnes y rota producto (FIFO)"",""score"":100}},""score"":100},""aseo"":{""score"":100,""items"":{""i3"":{""label"":""Uso correcto de gorra y guantes"",""score"":100},""i1"":{""score"":100,""label"":""Uniforme limpio y completo""},""i2"":{""score"":100,""label"":""Uñas cortas, sin joyas/auriculares""}}},""limpieza"":{""items"":{""i3"":{""label"":""Baños con insumos completos y sin olores"",""score"":100},""i2"":{""score"":100,""label"":""Plancha limpia y sin residuos""},""i1"":{""label"":""Cubetas rojas con sanitizer tibio"",""score"":100},""i4"":{""score"":100,""label"":""Exterior y basureros limpios""}},""score"":100},""bitacoras"":{""items"":{""i1"":{""score"":100,""label"":""Checklist apertura/cierre completo""},""i2"":{""label"":""Bitácora de temperaturas al día"",""score"":100},""i3"":{""score"":100,""label"":""Registros de limpieza firmados""}},""score"":100}}",https://drive.google.com/file/d/1BON9o5tMRxubvdG15wkJVvh4Hmj7Kqj9/view?usp=drivesdk,1BON9o5tMRxubvdG15wkJVvh4Hmj7Kqj9,https://drive.google.com/drive/folders/1T4No8pp61IKl1rKKEC_9BqvJ5g1fjh6U,1T4No8pp61IKl1rKKEC_9BqvJ5g1fjh6U,19,45,11,2025,89b46ce1-e2f0-41f2-9982-9e4ff0bdf3b4,cerrado,Roque,Roque,Roque,cerrado
11/4/2025 18:59:40,2025-11-04,18:54,PM,Downey,Wilian Aguilar,100,100,100,100,100,100,100,100,1- ENVONTRE LA SALSABAR  LIMONES FUERA DE CHAROLA,"{""limpieza"":{""score"":100,""items"":{""i4"":{""label"":""Exterior y basureros limpios"",""score"":100},""i3"":{""label"":""Baños con insumos completos y sin olores"",""score"":100},""i1"":{""label"":""Cubetas rojas con sanitizer tibio"",""score"":100},""i2"":{""score"":100,""label"":""Plancha limpia y sin residuos""}}},""servicio"":{""score"":100,""items"":{""i2"":{""score"":100,""label"":""Atiende con paciencia y respeto""},""i3"":{""score"":100,""label"":""Entrega órdenes con frase de cierre""},""i1"":{""label"":""Saluda y despide cordialmente"",""score"":100},""i4"":{""label"":""Evita charlas personales en línea"",""score"":100}}},""bitacoras"":{""items"":{""i1"":{""score"":100,""label"":""Checklist apertura/cierre completo""},""i2"":{""label"":""Bitácora de temperaturas al día"",""score"":100},""i3"":{""label"":""Registros de limpieza firmados"",""score"":100}},""score"":100},""alimentos"":{""score"":100,""items"":{""i2"":{""score"":100,""label"":""Quesadillas bien calientes, sin quemar""},""i3"":{""label"":""Burritos bien enrollados, sin dorar de más"",""score"":100},""i1"":{""label"":""Respeta porciones estándar (cucharas)"",""score"":100},""i4"":{""score"":100,""label"":""Stickers correctos donde aplica""}}},""aseo"":{""score"":100,""items"":{""i1"":{""score"":100,""label"":""Uniforme limpio y completo""},""i3"":{""score"":100,""label"":""Uso correcto de gorra y guantes""},""i2"":{""label"":""Uñas cortas, sin joyas/auriculares"",""score"":100}}},""carnes"":{""items"":{""i2"":{""label"":""Utensilios limpios, no golpear espátulas"",""score"":100},""i3"":{""score"":100,""label"":""Escurre carnes y rota producto (FIFO)""},""i4"":{""label"":""Vigila cebolla asada y porciones"",""score"":100},""i1"":{""label"":""Controla temperatura (450°/300°) y tiempos"",""score"":100}},""score"":100},""tortillas"":{""items"":{""i2"":{""label"":""Máx 5 tacos por plato (presentación)"",""score"":100},""i3"":{""label"":""Reponer a tiempo y mantener frescura"",""score"":100},""i1"":{""score"":100,""label"":""Tortillas bien calientes (aceite solo en orillas)""}},""score"":100}}",https://drive.google.com/file/d/1FrB5WOENHaO-jhJJV8981TUQboQBeFlo/view?usp=drivesdk,1FrB5WOENHaO-jhJJV8981TUQboQBeFlo,https://drive.google.com/drive/folders/1GZoHCHhrW6PlOdcWqld6o_BkvgX_JUVG,1GZoHCHhrW6PlOdcWqld6o_BkvgX_JUVG,20,45,11,2025,c3430626-5d88-411e-9e68-6f00a1b056d7,cerrado,Roque,Roque,Roque,cerrado
11/6/2025 12:50:26,2025-11-06,12:45,AM,Bell,Wilian Aguilar,90,100,100,100,100,100,100,99,,"{""limpieza"":{""score"":100,""items"":{""i4"":{""score"":100,""label"":""Exterior y basureros limpios""},""i1"":{""label"":""Cubetas rojas con sanitizer tibio"",""score"":100},""i3"":{""score"":100,""label"":""Baños con insumos completos y sin olores""},""i2"":{""score"":100,""label"":""Plancha limpia y sin residuos""}}},""bitacoras"":{""score"":100,""items"":{""i1"":{""label"":""Checklist apertura/cierre completo"",""score"":100},""i3"":{""label"":""Registros de limpieza firmados"",""score"":100},""i2"":{""label"":""Bitácora de temperaturas al día"",""score"":100}}},""carnes"":{""items"":{""i1"":{""label"":""Controla temperatura (450°/300°) y tiempos"",""score"":100},""i3"":{""score"":100,""label"":""Escurre carnes y rota producto (FIFO)""},""i2"":{""score"":100,""label"":""Utensilios limpios, no golpear espátulas""},""i4"":{""label"":""Vigila cebolla asada y porciones"",""score"":100}},""score"":100},""aseo"":{""score"":100,""items"":{""i1"":{""score"":100,""label"":""Uniforme limpio y completo""},""i3"":{""label"":""Uso correcto de gorra y guantes"",""score"":100},""i2"":{""label"":""Uñas cortas, sin joyas/auriculares"",""score"":100}}},""tortillas"":{""score"":100,""items"":{""i3"":{""score"":100,""label"":""Reponer a tiempo y mantener frescura""},""i1"":{""score"":100,""label"":""Tortillas bien calientes (aceite solo en orillas)""},""i2"":{""label"":""Máx 5 tacos por plato (presentación)"",""score"":100}}},""alimentos"":{""score"":100,""items"":{""i4"":{""label"":""Stickers correctos donde aplica"",""score"":100},""i1"":{""score"":100,""label"":""Respeta porciones estándar (cucharas)""},""i3"":{""score"":100,""label"":""Burritos bien enrollados, sin dorar de más""},""i2"":{""label"":""Quesadillas bien calientes, sin quemar"",""score"":100}}},""servicio"":{""score"":90,""items"":{""i1"":{""score"":100,""label"":""Saluda y despide cordialmente""},""i4"":{""score"":60,""label"":""Evita charlas personales en línea""},""i2"":{""label"":""Atiende con paciencia y respeto"",""score"":100},""i3"":{""score"":100,""label"":""Entrega órdenes con frase de cierre""}}}}",,,https://drive.google.com/drive/folders/1deQs1djK-1HLhgeOT-t_thIjX4a5ey11,1deQs1djK-1HLhgeOT-t_thIjX4a5ey11,21,45,11,2025,81e4b397-292f-4f8e-98e2-a3e1aaec08f7,cerrado,Roque,Roque,Roque,cerrado
11/6/2025 16:57:40,2025-11-06,16:51,AM,Lynwood,Wilian Aguilar,90,90,100,100,90,87,100,94,"1- encontre el baño sin papel ,
2- encontre turno de la noche no esta registrando la temperatura.","{""tortillas"":{""items"":{""i3"":{""score"":100,""label"":""Reponer a tiempo y mantener frescura""},""i2"":{""score"":100,""label"":""Máx 5 tacos por plato (presentación)""},""i1"":{""score"":100,""label"":""Tortillas bien calientes (aceite solo en orillas)""}},""score"":100},""servicio"":{""items"":{""i3"":{""label"":""Entrega órdenes con frase de cierre"",""score"":100},""i4"":{""score"":60,""label"":""Evita charlas personales en línea""},""i2"":{""label"":""Atiende con paciencia y respeto"",""score"":100},""i1"":{""score"":100,""label"":""Saluda y despide cordialmente""}},""score"":90},""aseo"":{""items"":{""i3"":{""label"":""Uso correcto de gorra y guantes"",""score"":100},""i2"":{""label"":""Uñas cortas, sin joyas/auriculares"",""score"":100},""i1"":{""label"":""Uniforme limpio y completo"",""score"":100}},""score"":100},""carnes"":{""items"":{""i4"":{""label"":""Vigila cebolla asada y porciones"",""score"":100},""i3"":{""score"":100,""label"":""Escurre carnes y rota producto (FIFO)""},""i2"":{""label"":""Utensilios limpios, no golpear espátulas"",""score"":100},""i1"":{""score"":60,""label"":""Controla temperatura (450°/300°) y tiempos""}},""score"":90},""limpieza"":{""score"":90,""items"":{""i2"":{""score"":100,""label"":""Plancha limpia y sin residuos""},""i1"":{""score"":100,""label"":""Cubetas rojas con sanitizer tibio""},""i3"":{""label"":""Baños con insumos completos y sin olores"",""score"":60},""i4"":{""score"":100,""label"":""Exterior y basureros limpios""}}},""bitacoras"":{""score"":87,""items"":{""i3"":{""label"":""Registros de limpieza firmados"",""score"":100},""i2"":{""label"":""Bitácora de temperaturas al día"",""score"":60},""i1"":{""label"":""Checklist apertura/cierre completo"",""score"":100}}},""alimentos"":{""items"":{""i1"":{""label"":""Respeta porciones estándar (cucharas)"",""score"":100},""i4"":{""label"":""Stickers correctos donde aplica"",""score"":100},""i3"":{""label"":""Burritos bien enrollados, sin dorar de más"",""score"":100},""i2"":{""score"":100,""label"":""Quesadillas bien calientes, sin quemar""}},""score"":100}}","https://drive.google.com/file/d/1fDQYZJGFp-w1gK95LybT1g5gdZR2OsaJ/view?usp=drivesdk
https://drive.google.com/file/d/18ffVYPsV6aEneV7j1fkuYjsF8lWUTeDg/view?usp=drivesdk","1fDQYZJGFp-w1gK95LybT1g5gdZR2OsaJ
18ffVYPsV6aEneV7j1fkuYjsF8lWUTeDg",https://drive.google.com/drive/folders/1WqF5Ql7yk9A4HEFGS73m-LWC3E0FrkLi,1WqF5Ql7yk9A4HEFGS73m-LWC3E0FrkLi,22,45,11,2025,bfb221cf-6e7b-4d30-8486-8a2a813a779c,cerrado,Roque,Roque,Roque,cerrado
11/6/2025 19:30:22,2025-11-06,19:28,PM,Downey,Wilian Aguilar,90,100,100,100,100,100,100,99,1 el salsabar encontre limpio,"{""tortillas"":{""items"":{""i1"":{""score"":100,""label"":""Tortillas bien calientes (aceite solo en orillas)""},""i2"":{""score"":100,""label"":""Máx 5 tacos por plato (presentación)""},""i3"":{""score"":100,""label"":""Reponer a tiempo y mantener frescura""}},""score"":100},""alimentos"":{""items"":{""i3"":{""score"":100,""label"":""Burritos bien enrollados, sin dorar de más""},""i1"":{""label"":""Respeta porciones estándar (cucharas)"",""score"":100},""i4"":{""label"":""Stickers correctos donde aplica"",""score"":100},""i2"":{""score"":100,""label"":""Quesadillas bien calientes, sin quemar""}},""score"":100},""limpieza"":{""score"":100,""items"":{""i1"":{""score"":100,""label"":""Cubetas rojas con sanitizer tibio""},""i4"":{""score"":100,""label"":""Exterior y basureros limpios""},""i3"":{""score"":100,""label"":""Baños con insumos completos y sin olores""},""i2"":{""label"":""Plancha limpia y sin residuos"",""score"":100}}},""bitacoras"":{""score"":100,""items"":{""i2"":{""label"":""Bitácora de temperaturas al día"",""score"":100},""i1"":{""score"":100,""label"":""Checklist apertura/cierre completo""},""i3"":{""label"":""Registros de limpieza firmados"",""score"":100}}},""carnes"":{""score"":100,""items"":{""i4"":{""label"":""Vigila cebolla asada y porciones"",""score"":100},""i3"":{""label"":""Escurre carnes y rota producto (FIFO)"",""score"":100},""i2"":{""score"":100,""label"":""Utensilios limpios, no golpear espátulas""},""i1"":{""label"":""Controla temperatura (450°/300°) y tiempos"",""score"":100}}},""servicio"":{""items"":{""i1"":{""score"":100,""label"":""Saluda y despide cordialmente""},""i3"":{""score"":60,""label"":""Entrega órdenes con frase de cierre""},""i4"":{""label"":""Evita charlas personales en línea"",""score"":100},""i2"":{""label"":""Atiende con paciencia y respeto"",""score"":100}},""score"":90},""aseo"":{""items"":{""i3"":{""score"":100,""label"":""Uso correcto de gorra y guantes""},""i2"":{""score"":100,""label"":""Uñas cortas, sin joyas/auriculares""},""i1"":{""label"":""Uniforme limpio y completo"",""score"":100}},""score"":100}}",https://drive.google.com/file/d/1Apoyj3UJY8UyYFD6mi7gxPFhEh7Cyvjg/view?usp=drivesdk,1Apoyj3UJY8UyYFD6mi7gxPFhEh7Cyvjg,https://drive.google.com/drive/folders/1EKF1pyZIn4LE_50skXCNeNDXjXpqD2_p,1EKF1pyZIn4LE_50skXCNeNDXjXpqD2_p,23,45,11,2025,c2c5d9c7-c739-4000-83c9-15798189b8c8,cerrado,Roque,Roque,Roque,cerrado
11/7/2025 17:19:40,2025-11-07,17:15,PM,Downey,Wilian Aguilar,100,100,100,100,100,100,0,86,"1 el agua del sink estaba muy cliente , se le vajo la temperatura Boiler 139*F","{""carnes"":{""score"":100,""items"":{""i1"":{""label"":""Controla temperatura (450°/300°) y tiempos"",""score"":100},""i2"":{""score"":100,""label"":""Utensilios limpios, no golpear espátulas""},""i3"":{""score"":100,""label"":""Escurre carnes y rota producto (FIFO)""},""i4"":{""label"":""Vigila cebolla asada y porciones"",""score"":100}}},""aseo"":{""items"":{""i2"":{""score"":0,""label"":""Uñas cortas, sin joyas/auriculares""},""i3"":{""label"":""Uso correcto de gorra y guantes"",""score"":0},""i1"":{""score"":0,""label"":""Uniforme limpio y completo""}},""score"":0},""alimentos"":{""items"":{""i2"":{""label"":""Quesadillas bien calientes, sin quemar"",""score"":100},""i3"":{""label"":""Burritos bien enrollados, sin dorar de más"",""score"":100},""i4"":{""label"":""Stickers correctos donde aplica"",""score"":100},""i1"":{""score"":100,""label"":""Respeta porciones estándar (cucharas)""}},""score"":100},""bitacoras"":{""items"":{""i3"":{""score"":100,""label"":""Registros de limpieza firmados""},""i2"":{""score"":100,""label"":""Bitácora de temperaturas al día""},""i1"":{""score"":100,""label"":""Checklist apertura/cierre completo""}},""score"":100},""limpieza"":{""items"":{""i2"":{""score"":100,""label"":""Plancha limpia y sin residuos""},""i4"":{""score"":100,""label"":""Exterior y basureros limpios""},""i1"":{""label"":""Cubetas rojas con sanitizer tibio"",""score"":100},""i3"":{""label"":""Baños con insumos completos y sin olores"",""score"":100}},""score"":100},""servicio"":{""score"":100,""items"":{""i4"":{""label"":""Evita charlas personales en línea"",""score"":100},""i3"":{""label"":""Entrega órdenes con frase de cierre"",""score"":100},""i1"":{""score"":100,""label"":""Saluda y despide cordialmente""},""i2"":{""score"":100,""label"":""Atiende con paciencia y respeto""}}},""tortillas"":{""items"":{""i3"":{""score"":100,""label"":""Reponer a tiempo y mantener frescura""},""i1"":{""label"":""Tortillas bien calientes (aceite solo en orillas)"",""score"":100},""i2"":{""label"":""Máx 5 tacos por plato (presentación)"",""score"":100}},""score"":100}}",,,https://drive.google.com/drive/folders/1mak5TFaUa6xaT_zL69d0dARAyvSxRbjT,1mak5TFaUa6xaT_zL69d0dARAyvSxRbjT,24,45,11,2025,01797e1c-2f0f-446f-912b-53efa565b36f,cerrado,Roque,Roque,Roque,cerrado
11/7/2025 18:40:36,2025-11-07,18:38,PM,South Gate,Wilian Aguilar,90,100,100,100,100,100,100,99,,"{""carnes"":{""items"":{""i2"":{""score"":100,""label"":""Utensilios limpios, no golpear espátulas""},""i1"":{""label"":""Controla temperatura (450°/300°) y tiempos"",""score"":100},""i3"":{""label"":""Escurre carnes y rota producto (FIFO)"",""score"":100},""i4"":{""label"":""Vigila cebolla asada y porciones"",""score"":100}},""score"":100},""bitacoras"":{""items"":{""i1"":{""score"":100,""label"":""Checklist apertura/cierre completo""},""i2"":{""score"":100,""label"":""Bitácora de temperaturas al día""},""i3"":{""score"":100,""label"":""Registros de limpieza firmados""}},""score"":100},""tortillas"":{""items"":{""i3"":{""score"":100,""label"":""Reponer a tiempo y mantener frescura""},""i1"":{""score"":100,""label"":""Tortillas bien calientes (aceite solo en orillas)""},""i2"":{""label"":""Máx 5 tacos por plato (presentación)"",""score"":100}},""score"":100},""limpieza"":{""items"":{""i3"":{""label"":""Baños con insumos completos y sin olores"",""score"":0},""i2"":{""score"":100,""label"":""Plancha limpia y sin residuos""},""i1"":{""label"":""Cubetas rojas con sanitizer tibio"",""score"":100},""i4"":{""score"":100,""label"":""Exterior y basureros limpios""}},""score"":100},""aseo"":{""score"":100,""items"":{""i1"":{""label"":""Uniforme limpio y completo"",""score"":100},""i2"":{""score"":100,""label"":""Uñas cortas, sin joyas/auriculares""},""i3"":{""score"":100,""label"":""Uso correcto de gorra y guantes""}}},""alimentos"":{""score"":100,""items"":{""i3"":{""score"":100,""label"":""Burritos bien enrollados, sin dorar de más""},""i2"":{""score"":100,""label"":""Quesadillas bien calientes, sin quemar""},""i4"":{""score"":100,""label"":""Stickers correctos donde aplica""},""i1"":{""score"":100,""label"":""Respeta porciones estándar (cucharas)""}}},""servicio"":{""score"":90,""items"":{""i3"":{""label"":""Entrega órdenes con frase de cierre"",""score"":100},""i1"":{""label"":""Saluda y despide cordialmente"",""score"":100},""i2"":{""score"":100,""label"":""Atiende con paciencia y respeto""},""i4"":{""label"":""Evita charlas personales en línea"",""score"":60}}}}",,,https://drive.google.com/drive/folders/1fKC4EbHkXOOrR00IpBySqJ2Br8x9iQYK,1fKC4EbHkXOOrR00IpBySqJ2Br8x9iQYK,25,45,11,2025,f3acc139-2b9c-4842-b65e-a478c32f0ee2,cerrado,Roque,Roque,Roque,cerrado
11/7/2025 20:04:23,2025-11-07,19:45,PM,Bell,Wilian Aguilar,100,100,90,100,100,100,100,99,1- encontre que no se estaba siguiendo el procedimiento de los burritos hable con manejador para dar entrenamiento al equipo de trabajo.,"{""carnes"":{""score"":100,""items"":{""i2"":{""score"":100,""label"":""Utensilios limpios, no golpear espátulas""},""i3"":{""label"":""Escurre carnes y rota producto (FIFO)"",""score"":100},""i4"":{""score"":0,""label"":""Vigila cebolla asada y porciones""},""i1"":{""score"":100,""label"":""Controla temperatura (450°/300°) y tiempos""}}},""bitacoras"":{""score"":100,""items"":{""i2"":{""label"":""Bitácora de temperaturas al día"",""score"":100},""i3"":{""label"":""Registros de limpieza firmados"",""score"":100},""i1"":{""label"":""Checklist apertura/cierre completo"",""score"":100}}},""servicio"":{""score"":100,""items"":{""i1"":{""label"":""Saluda y despide cordialmente"",""score"":100},""i2"":{""score"":100,""label"":""Atiende con paciencia y respeto""},""i4"":{""score"":100,""label"":""Evita charlas personales en línea""},""i3"":{""label"":""Entrega órdenes con frase de cierre"",""score"":100}}},""tortillas"":{""score"":100,""items"":{""i1"":{""label"":""Tortillas bien calientes (aceite solo en orillas)"",""score"":100},""i2"":{""label"":""Máx 5 tacos por plato (presentación)"",""score"":100},""i3"":{""label"":""Reponer a tiempo y mantener frescura"",""score"":100}}},""limpieza"":{""score"":100,""items"":{""i4"":{""label"":""Exterior y basureros limpios"",""score"":100},""i1"":{""score"":100,""label"":""Cubetas rojas con sanitizer tibio""},""i2"":{""label"":""Plancha limpia y sin residuos"",""score"":100},""i3"":{""label"":""Baños con insumos completos y sin olores"",""score"":100}}},""aseo"":{""score"":100,""items"":{""i2"":{""score"":100,""label"":""Uñas cortas, sin joyas/auriculares""},""i1"":{""score"":100,""label"":""Uniforme limpio y completo""},""i3"":{""label"":""Uso correcto de gorra y guantes"",""score"":100}}},""alimentos"":{""score"":90,""items"":{""i1"":{""label"":""Respeta porciones estándar (cucharas)"",""score"":100},""i4"":{""score"":100,""label"":""Stickers correctos donde aplica""},""i2"":{""score"":100,""label"":""Quesadillas bien calientes, sin quemar""},""i3"":{""score"":60,""label"":""Burritos bien enrollados, sin dorar de más""}}}}",,,https://drive.google.com/drive/folders/1nWxfaEaGsQb1QLyfC7N3b0eTzjiFEsx1,1nWxfaEaGsQb1QLyfC7N3b0eTzjiFEsx1,26,45,11,2025,ea3bd3ab-8568-4601-8aff-1c181f80643b,cerrado,Roque,Roque,Roque,cerrado
11/7/2025 22:14:34,2025-11-07,22:08,PM,Lynwood,Wilian Aguilar,90,100,100,100,90,87,100,95,1- Mantener la entrada del restaurante limpio,"{""carnes"":{""items"":{""i3"":{""score"":100,""label"":""Escurre carnes y rota producto (FIFO)""},""i1"":{""label"":""Controla temperatura (450°/300°) y tiempos"",""score"":100},""i4"":{""score"":100,""label"":""Vigila cebolla asada y porciones""},""i2"":{""score"":100,""label"":""Utensilios limpios, no golpear espátulas""}},""score"":100},""alimentos"":{""items"":{""i3"":{""label"":""Burritos bien enrollados, sin dorar de más"",""score"":100},""i2"":{""label"":""Quesadillas bien calientes, sin quemar"",""score"":100},""i1"":{""score"":100,""label"":""Respeta porciones estándar (cucharas)""},""i4"":{""score"":100,""label"":""Stickers correctos donde aplica""}},""score"":100},""limpieza"":{""score"":90,""items"":{""i2"":{""score"":100,""label"":""Plancha limpia y sin residuos""},""i4"":{""score"":60,""label"":""Exterior y basureros limpios""},""i1"":{""label"":""Cubetas rojas con sanitizer tibio"",""score"":100},""i3"":{""score"":100,""label"":""Baños con insumos completos y sin olores""}}},""servicio"":{""score"":90,""items"":{""i1"":{""label"":""Saluda y despide cordialmente"",""score"":100},""i4"":{""label"":""Evita charlas personales en línea"",""score"":60},""i2"":{""label"":""Atiende con paciencia y respeto"",""score"":100},""i3"":{""label"":""Entrega órdenes con frase de cierre"",""score"":100}}},""aseo"":{""score"":100,""items"":{""i3"":{""score"":100,""label"":""Uso correcto de gorra y guantes""},""i2"":{""label"":""Uñas cortas, sin joyas/auriculares"",""score"":100},""i1"":{""label"":""Uniforme limpio y completo"",""score"":100}}},""bitacoras"":{""score"":87,""items"":{""i1"":{""label"":""Checklist apertura/cierre completo"",""score"":100},""i2"":{""score"":100,""label"":""Bitácora de temperaturas al día""},""i3"":{""score"":60,""label"":""Registros de limpieza firmados""}}},""tortillas"":{""items"":{""i3"":{""score"":100,""label"":""Reponer a tiempo y mantener frescura""},""i1"":{""score"":100,""label"":""Tortillas bien calientes (aceite solo en orillas)""},""i2"":{""label"":""Máx 5 tacos por plato (presentación)"",""score"":100}},""score"":100}}",https://drive.google.com/file/d/1Rqt4e0FHDuiq1synAaDwkP5ThTqH1erp/view?usp=drivesdk,1Rqt4e0FHDuiq1synAaDwkP5ThTqH1erp,https://drive.google.com/drive/folders/1lNiG9dHuTd27t2Zpb9Pz2v4rZlGE-T36,1lNiG9dHuTd27t2Zpb9Pz2v4rZlGE-T36,27,45,11,2025,cd8e26d8-6c2a-4381-8d32-1e820225d37f,cerrado,Roque,Roque,Roque,cerrado
11/8/2025 13:31:35,2025-11-08,13:12,AM,Lynwood,Wilian Aguilar,100,100,100,100,90,100,100,99,"1, encontre las aguas del horchata apagadas aproximadamente 11 minutos
2 limpiar de atras donde estan los botes de basura","{""carnes"":{""items"":{""i3"":{""score"":100,""label"":""Escurre carnes y rota producto (FIFO)""},""i4"":{""score"":100,""label"":""Vigila cebolla asada y porciones""},""i2"":{""label"":""Utensilios limpios, no golpear espátulas"",""score"":100},""i1"":{""label"":""Controla temperatura (450°/300°) y tiempos"",""score"":100}},""score"":100},""servicio"":{""score"":100,""items"":{""i4"":{""label"":""Evita charlas personales en línea"",""score"":100},""i3"":{""label"":""Entrega órdenes con frase de cierre"",""score"":100},""i2"":{""score"":100,""label"":""Atiende con paciencia y respeto""},""i1"":{""score"":100,""label"":""Saluda y despide cordialmente""}}},""alimentos"":{""items"":{""i4"":{""score"":100,""label"":""Stickers correctos donde aplica""},""i1"":{""score"":100,""label"":""Respeta porciones estándar (cucharas)""},""i3"":{""score"":100,""label"":""Burritos bien enrollados, sin dorar de más""},""i2"":{""score"":100,""label"":""Quesadillas bien calientes, sin quemar""}},""score"":100},""limpieza"":{""score"":90,""items"":{""i1"":{""score"":100,""label"":""Cubetas rojas con sanitizer tibio""},""i4"":{""score"":60,""label"":""Exterior y basureros limpios""},""i2"":{""score"":100,""label"":""Plancha limpia y sin residuos""},""i3"":{""score"":100,""label"":""Baños con insumos completos y sin olores""}}},""bitacoras"":{""items"":{""i2"":{""score"":100,""label"":""Bitácora de temperaturas al día""},""i1"":{""score"":100,""label"":""Checklist apertura/cierre completo""},""i3"":{""label"":""Registros de limpieza firmados"",""score"":100}},""score"":100},""aseo"":{""score"":100,""items"":{""i3"":{""score"":100,""label"":""Uso correcto de gorra y guantes""},""i2"":{""score"":100,""label"":""Uñas cortas, sin joyas/auriculares""},""i1"":{""label"":""Uniforme limpio y completo"",""score"":100}}},""tortillas"":{""items"":{""i1"":{""score"":100,""label"":""Tortillas bien calientes (aceite solo en orillas)""},""i3"":{""score"":100,""label"":""Reponer a tiempo y mantener frescura""},""i2"":{""label"":""Máx 5 tacos por plato (presentación)"",""score"":100}},""score"":100}}","https://drive.google.com/file/d/131LCj-di7U5fBIZGPNpaLM8uxKcyzB-N/view?usp=drivesdk
https://drive.google.com/file/d/12ST_oLwVH5er9s6KnA0UqkMMUpVd0oMv/view?usp=drivesdk
https://drive.google.com/file/d/1nniQe5efp21Lx5EdvYfWE63y9BS2xgeC/view?usp=drivesdk","131LCj-di7U5fBIZGPNpaLM8uxKcyzB-N
12ST_oLwVH5er9s6KnA0UqkMMUpVd0oMv
1nniQe5efp21Lx5EdvYfWE63y9BS2xgeC",https://drive.google.com/drive/folders/1Rpr5-wDBcI9BK6z5tDUj454OWbA-Pzsp,1Rpr5-wDBcI9BK6z5tDUj454OWbA-Pzsp,28,45,11,2025,db3bee04-2788-4af1-bf4e-90432441729e,cerrado,Roque,Roque,Roque,cerrado
11/8/2025 14:26:48,2025-11-08,14:20,AM,South Gate,Wilian Aguilar,87,100,100,100,100,87,100,96,"1 Mantener limpia mesa 
2 limpieza sign drive thru","{""tortillas"":{""score"":100,""items"":{""i1"":{""score"":100,""label"":""Tortillas bien calientes (aceite solo en orillas)""},""i3"":{""label"":""Reponer a tiempo y mantener frescura"",""score"":100},""i2"":{""score"":100,""label"":""Máx 5 tacos por plato (presentación)""}}},""aseo"":{""items"":{""i2"":{""score"":100,""label"":""Uñas cortas, sin joyas/auriculares""},""i3"":{""score"":100,""label"":""Uso correcto de gorra y guantes""},""i1"":{""score"":100,""label"":""Uniforme limpio y completo""}},""score"":100},""carnes"":{""items"":{""i3"":{""score"":100,""label"":""Escurre carnes y rota producto (FIFO)""},""i2"":{""label"":""Utensilios limpios, no golpear espátulas"",""score"":100},""i4"":{""label"":""Vigila cebolla asada y porciones"",""score"":100},""i1"":{""score"":100,""label"":""Controla temperatura (450°/300°) y tiempos""}},""score"":100},""bitacoras"":{""score"":87,""items"":{""i2"":{""score"":100,""label"":""Bitácora de temperaturas al día""},""i3"":{""score"":60,""label"":""Registros de limpieza firmados""},""i1"":{""score"":100,""label"":""Checklist apertura/cierre completo""}}},""limpieza"":{""items"":{""i2"":{""label"":""Plancha limpia y sin residuos"",""score"":100},""i4"":{""label"":""Exterior y basureros limpios"",""score"":100},""i3"":{""score"":100,""label"":""Baños con insumos completos y sin olores""},""i1"":{""label"":""Cubetas rojas con sanitizer tibio"",""score"":100}},""score"":100},""alimentos"":{""items"":{""i2"":{""score"":100,""label"":""Quesadillas bien calientes, sin quemar""},""i3"":{""score"":100,""label"":""Burritos bien enrollados, sin dorar de más""},""i1"":{""score"":100,""label"":""Respeta porciones estándar (cucharas)""},""i4"":{""label"":""Stickers correctos donde aplica"",""score"":100}},""score"":100},""servicio"":{""items"":{""i3"":{""score"":100,""label"":""Entrega órdenes con frase de cierre""},""i2"":{""label"":""Atiende con paciencia y respeto"",""score"":100},""i4"":{""label"":""Evita charlas personales en línea"",""score"":60},""i1"":{""label"":""Saluda y despide cordialmente"",""score"":0}},""score"":87}}",https://drive.google.com/file/d/1PKcxG8DpUEwWggerofkWt1cUueEaYkUS/view?usp=drivesdk,1PKcxG8DpUEwWggerofkWt1cUueEaYkUS,https://drive.google.com/drive/folders/1fTyd2HUdF1YI36HX8_SF5urzp0aRVCx6,1fTyd2HUdF1YI36HX8_SF5urzp0aRVCx6,29,45,11,2025,7a40c750-a4ef-4e66-ba29-8d2f5ae006f5,cerrado,Roque,Roque,Roque,cerrado
11/8/2025 15:21:24,2025-11-08,15:04,AM,Downey,Wilian Aguilar,90,100,100,100,100,100,100,99,"Encontre muy limpio el salón piso ,sillas y mesas","{""alimentos"":{""items"":{""i3"":{""score"":100,""label"":""Burritos bien enrollados, sin dorar de más""},""i2"":{""label"":""Quesadillas bien calientes, sin quemar"",""score"":100},""i1"":{""label"":""Respeta porciones estándar (cucharas)"",""score"":100},""i4"":{""label"":""Stickers correctos donde aplica"",""score"":100}},""score"":100},""servicio"":{""items"":{""i4"":{""score"":60,""label"":""Evita charlas personales en línea""},""i3"":{""label"":""Entrega órdenes con frase de cierre"",""score"":100},""i2"":{""score"":100,""label"":""Atiende con paciencia y respeto""},""i1"":{""score"":100,""label"":""Saluda y despide cordialmente""}},""score"":90},""limpieza"":{""items"":{""i1"":{""score"":100,""label"":""Cubetas rojas con sanitizer tibio""},""i3"":{""label"":""Baños con insumos completos y sin olores"",""score"":100},""i2"":{""score"":100,""label"":""Plancha limpia y sin residuos""},""i4"":{""label"":""Exterior y basureros limpios"",""score"":100}},""score"":100},""carnes"":{""score"":100,""items"":{""i1"":{""label"":""Controla temperatura (450°/300°) y tiempos"",""score"":100},""i3"":{""label"":""Escurre carnes y rota producto (FIFO)"",""score"":100},""i2"":{""score"":100,""label"":""Utensilios limpios, no golpear espátulas""},""i4"":{""label"":""Vigila cebolla asada y porciones"",""score"":100}}},""aseo"":{""items"":{""i2"":{""score"":100,""label"":""Uñas cortas, sin joyas/auriculares""},""i1"":{""label"":""Uniforme limpio y completo"",""score"":100},""i3"":{""label"":""Uso correcto de gorra y guantes"",""score"":100}},""score"":100},""tortillas"":{""items"":{""i1"":{""label"":""Tortillas bien calientes (aceite solo en orillas)"",""score"":100},""i3"":{""label"":""Reponer a tiempo y mantener frescura"",""score"":100},""i2"":{""score"":100,""label"":""Máx 5 tacos por plato (presentación)""}},""score"":100},""bitacoras"":{""score"":100,""items"":{""i2"":{""score"":100,""label"":""Bitácora de temperaturas al día""},""i1"":{""label"":""Checklist apertura/cierre completo"",""score"":100},""i3"":{""label"":""Registros de limpieza firmados"",""score"":100}}}}",https://drive.google.com/file/d/1w5qKqwbFpdCTKQXNYcgGBBINv6qYkAZK/view?usp=drivesdk,1w5qKqwbFpdCTKQXNYcgGBBINv6qYkAZK,https://drive.google.com/drive/folders/1X70vEvIRtupxM_42EdiXxBNLC6UnJSAQ,1X70vEvIRtupxM_42EdiXxBNLC6UnJSAQ,30,45,11,2025,e4958dd4-1ee1-4ae1-92da-94fc5bff44db,cerrado,Roque,Roque,Roque,cerrado
11/9/2025 14:42:36,2025-11-09,14:37,AM,South Gate,Wilian Aguilar,90,100,100,100,100,100,100,99,1 encontre el carton afuera de la maquina de reciclaje de carton,"{""bitacoras"":{""score"":100,""items"":{""i1"":{""label"":""Checklist apertura/cierre completo"",""score"":100},""i2"":{""score"":100,""label"":""Bitácora de temperaturas al día""},""i3"":{""label"":""Registros de limpieza firmados"",""score"":100}}},""servicio"":{""items"":{""i1"":{""label"":""Saluda y despide cordialmente"",""score"":100},""i2"":{""label"":""Atiende con paciencia y respeto"",""score"":100},""i3"":{""score"":100,""label"":""Entrega órdenes con frase de cierre""},""i4"":{""score"":60,""label"":""Evita charlas personales en línea""}},""score"":90},""aseo"":{""items"":{""i1"":{""label"":""Uniforme limpio y completo"",""score"":100},""i2"":{""score"":100,""label"":""Uñas cortas, sin joyas/auriculares""},""i3"":{""score"":100,""label"":""Uso correcto de gorra y guantes""}},""score"":100},""limpieza"":{""score"":100,""items"":{""i4"":{""label"":""Exterior y basureros limpios"",""score"":100},""i3"":{""label"":""Baños con insumos completos y sin olores"",""score"":100},""i1"":{""score"":100,""label"":""Cubetas rojas con sanitizer tibio""},""i2"":{""label"":""Plancha limpia y sin residuos"",""score"":100}}},""alimentos"":{""items"":{""i4"":{""score"":100,""label"":""Stickers correctos donde aplica""},""i3"":{""score"":100,""label"":""Burritos bien enrollados, sin dorar de más""},""i1"":{""score"":100,""label"":""Respeta porciones estándar (cucharas)""},""i2"":{""label"":""Quesadillas bien calientes, sin quemar"",""score"":100}},""score"":100},""tortillas"":{""score"":100,""items"":{""i1"":{""label"":""Tortillas bien calientes (aceite solo en orillas)"",""score"":100},""i3"":{""label"":""Reponer a tiempo y mantener frescura"",""score"":100},""i2"":{""score"":100,""label"":""Máx 5 tacos por plato (presentación)""}}},""carnes"":{""score"":100,""items"":{""i3"":{""label"":""Escurre carnes y rota producto (FIFO)"",""score"":100},""i1"":{""label"":""Controla temperatura (450°/300°) y tiempos"",""score"":100},""i2"":{""label"":""Utensilios limpios, no golpear espátulas"",""score"":100},""i4"":{""score"":100,""label"":""Vigila cebolla asada y porciones""}}}}",https://drive.google.com/file/d/1a24LgBK1Cslft9s1k6Zi3eWYO0c5592P/view?usp=drivesdk,1a24LgBK1Cslft9s1k6Zi3eWYO0c5592P,https://drive.google.com/drive/folders/10PEVTMyDnZXrguO29x5JRGuRSTyqo6Xb,10PEVTMyDnZXrguO29x5JRGuRSTyqo6Xb,31,46,11,2025,3e05a059-9da3-48f1-992b-4ff46266b88c,cerrado,Roque,Roque,Roque,cerrado
11/9/2025 19:32:02,2025-11-09,19:28,PM,Bell,Wilian Aguilar,90,100,100,100,100,100,100,99,El salsabar limpio y lleno,"{""carnes"":{""score"":100,""items"":{""i3"":{""label"":""Escurre carnes y rota producto (FIFO)"",""score"":100},""i4"":{""label"":""Vigila cebolla asada y porciones"",""score"":100},""i2"":{""label"":""Utensilios limpios, no golpear espátulas"",""score"":100},""i1"":{""score"":100,""label"":""Controla temperatura (450°/300°) y tiempos""}}},""bitacoras"":{""score"":100,""items"":{""i1"":{""score"":100,""label"":""Checklist apertura/cierre completo""},""i2"":{""score"":100,""label"":""Bitácora de temperaturas al día""},""i3"":{""label"":""Registros de limpieza firmados"",""score"":100}}},""limpieza"":{""items"":{""i3"":{""score"":100,""label"":""Baños con insumos completos y sin olores""},""i4"":{""score"":100,""label"":""Exterior y basureros limpios""},""i2"":{""label"":""Plancha limpia y sin residuos"",""score"":100},""i1"":{""score"":100,""label"":""Cubetas rojas con sanitizer tibio""}},""score"":100},""servicio"":{""items"":{""i1"":{""label"":""Saluda y despide cordialmente"",""score"":100},""i2"":{""label"":""Atiende con paciencia y respeto"",""score"":100},""i4"":{""label"":""Evita charlas personales en línea"",""score"":60},""i3"":{""score"":100,""label"":""Entrega órdenes con frase de cierre""}},""score"":90},""tortillas"":{""score"":100,""items"":{""i2"":{""label"":""Máx 5 tacos por plato (presentación)"",""score"":100},""i3"":{""score"":100,""label"":""Reponer a tiempo y mantener frescura""},""i1"":{""score"":100,""label"":""Tortillas bien calientes (aceite solo en orillas)""}}},""aseo"":{""score"":100,""items"":{""i1"":{""score"":100,""label"":""Uniforme limpio y completo""},""i2"":{""score"":100,""label"":""Uñas cortas, sin joyas/auriculares""},""i3"":{""score"":100,""label"":""Uso correcto de gorra y guantes""}}},""alimentos"":{""items"":{""i3"":{""score"":100,""label"":""Burritos bien enrollados, sin dorar de más""},""i2"":{""score"":100,""label"":""Quesadillas bien calientes, sin quemar""},""i1"":{""score"":100,""label"":""Respeta porciones estándar (cucharas)""},""i4"":{""label"":""Stickers correctos donde aplica"",""score"":100}},""score"":100}}",https://drive.google.com/file/d/1eg_Wn_cba-IkGGyG6tp-5N152wj9OYx-/view?usp=drivesdk,1eg_Wn_cba-IkGGyG6tp-5N152wj9OYx-,https://drive.google.com/drive/folders/12GNmLwRDCPbrnDiGTIOwcXd-6Wi4Z3fC,12GNmLwRDCPbrnDiGTIOwcXd-6Wi4Z3fC,32,46,11,2025,c33484b9-3a60-4a43-bb9c-94e966950207,cerrado,Roque,Roque,Roque,cerrado
11/9/2025 20:55:15,2025-11-09,20:51,PM,Downey,Wilian Aguilar,100,100,100,100,90,100,100,99,Encontre mesas no limpias,"{""alimentos"":{""items"":{""i1"":{""score"":100,""label"":""Respeta porciones estándar (cucharas)""},""i3"":{""label"":""Burritos bien enrollados, sin dorar de más"",""score"":100},""i2"":{""score"":100,""label"":""Quesadillas bien calientes, sin quemar""},""i4"":{""label"":""Stickers correctos donde aplica"",""score"":100}},""score"":100},""tortillas"":{""items"":{""i3"":{""score"":100,""label"":""Reponer a tiempo y mantener frescura""},""i2"":{""score"":100,""label"":""Máx 5 tacos por plato (presentación)""},""i1"":{""label"":""Tortillas bien calientes (aceite solo en orillas)"",""score"":100}},""score"":100},""aseo"":{""items"":{""i1"":{""label"":""Uniforme limpio y completo"",""score"":100},""i2"":{""label"":""Uñas cortas, sin joyas/auriculares"",""score"":100},""i3"":{""label"":""Uso correcto de gorra y guantes"",""score"":100}},""score"":100},""limpieza"":{""score"":90,""items"":{""i1"":{""score"":100,""label"":""Cubetas rojas con sanitizer tibio""},""i2"":{""label"":""Plancha limpia y sin residuos"",""score"":100},""i3"":{""score"":100,""label"":""Baños con insumos completos y sin olores""},""i4"":{""label"":""Exterior y basureros limpios"",""score"":60}}},""servicio"":{""items"":{""i4"":{""label"":""Evita charlas personales en línea"",""score"":100},""i3"":{""score"":100,""label"":""Entrega órdenes con frase de cierre""},""i1"":{""label"":""Saluda y despide cordialmente"",""score"":100},""i2"":{""label"":""Atiende con paciencia y respeto"",""score"":100}},""score"":100},""carnes"":{""items"":{""i3"":{""score"":100,""label"":""Escurre carnes y rota producto (FIFO)""},""i2"":{""label"":""Utensilios limpios, no golpear espátulas"",""score"":100},""i1"":{""label"":""Controla temperatura (450°/300°) y tiempos"",""score"":100},""i4"":{""score"":100,""label"":""Vigila cebolla asada y porciones""}},""score"":100},""bitacoras"":{""score"":100,""items"":{""i2"":{""label"":""Bitácora de temperaturas al día"",""score"":100},""i1"":{""score"":100,""label"":""Checklist apertura/cierre completo""},""i3"":{""score"":100,""label"":""Registros de limpieza firmados""}}}}",https://drive.google.com/file/d/14YZE_DXYZhUDKbJ3Lf-vL7gv3D_2To0b/view?usp=drivesdk,14YZE_DXYZhUDKbJ3Lf-vL7gv3D_2To0b,https://drive.google.com/drive/folders/12dW-ZcupgpsiEVAJaSYK0yilEq1s3Wnh,12dW-ZcupgpsiEVAJaSYK0yilEq1s3Wnh,33,46,11,2025,ebd0c0bb-1153-4b4f-98f9-cd2dc342d8de,cerrado,Roque,Roque,Roque,cerrado
11/10/2025 11:46:13,2025-11-10,11:42,AM,Bell,Wilian Aguilar,90,100,100,100,100,100,100,99,Apertura  esta muy limpio,"{""tortillas"":{""items"":{""i1"":{""score"":100,""label"":""Tortillas bien calientes (aceite solo en orillas)""},""i3"":{""label"":""Reponer a tiempo y mantener frescura"",""score"":100},""i2"":{""label"":""Máx 5 tacos por plato (presentación)"",""score"":100}},""score"":100},""alimentos"":{""score"":100,""items"":{""i1"":{""label"":""Respeta porciones estándar (cucharas)"",""score"":100},""i4"":{""label"":""Stickers correctos donde aplica"",""score"":100},""i2"":{""score"":100,""label"":""Quesadillas bien calientes, sin quemar""},""i3"":{""label"":""Burritos bien enrollados, sin dorar de más"",""score"":100}}},""bitacoras"":{""score"":100,""items"":{""i3"":{""label"":""Registros de limpieza firmados"",""score"":100},""i1"":{""score"":100,""label"":""Checklist apertura/cierre completo""},""i2"":{""label"":""Bitácora de temperaturas al día"",""score"":100}}},""aseo"":{""items"":{""i1"":{""label"":""Uniforme limpio y completo"",""score"":100},""i2"":{""score"":100,""label"":""Uñas cortas, sin joyas/auriculares""},""i3"":{""score"":100,""label"":""Uso correcto de gorra y guantes""}},""score"":100},""servicio"":{""score"":90,""items"":{""i2"":{""label"":""Atiende con paciencia y respeto"",""score"":100},""i3"":{""score"":100,""label"":""Entrega órdenes con frase de cierre""},""i4"":{""label"":""Evita charlas personales en línea"",""score"":60},""i1"":{""score"":100,""label"":""Saluda y despide cordialmente""}}},""carnes"":{""score"":100,""items"":{""i3"":{""label"":""Escurre carnes y rota producto (FIFO)"",""score"":100},""i4"":{""score"":100,""label"":""Vigila cebolla asada y porciones""},""i1"":{""score"":100,""label"":""Controla temperatura (450°/300°) y tiempos""},""i2"":{""score"":100,""label"":""Utensilios limpios, no golpear espátulas""}}},""limpieza"":{""items"":{""i2"":{""score"":100,""label"":""Plancha limpia y sin residuos""},""i1"":{""label"":""Cubetas rojas con sanitizer tibio"",""score"":100},""i4"":{""score"":100,""label"":""Exterior y basureros limpios""},""i3"":{""label"":""Baños con insumos completos y sin olores"",""score"":100}},""score"":100}}","https://drive.google.com/file/d/1RBiyD3b1rammEop7Tkj5tuDGqyL74dQd/view?usp=drivesdk
https://drive.google.com/file/d/1PEFZj7q1sEyOJYdGkgs85W5mPjuZcL5h/view?usp=drivesdk","1RBiyD3b1rammEop7Tkj5tuDGqyL74dQd
1PEFZj7q1sEyOJYdGkgs85W5mPjuZcL5h",https://drive.google.com/drive/folders/1C-331nygFQLR81Q2P6G3AXY-tXVlk76v,1C-331nygFQLR81Q2P6G3AXY-tXVlk76v,34,46,11,2025,6aef71a6-97e8-4558-8399-e95ec2514d5e,cerrado,Roque,Roque,Roque,cerrado
11/10/2025 13:26:29,2025-11-10,13:22,AM,South Gate,Wilian Aguilar,100,100,100,100,90,100,100,99,Encontre el carton fuera de la maquina del carton.,"{""servicio"":{""items"":{""i4"":{""score"":100,""label"":""Evita charlas personales en línea""},""i2"":{""score"":100,""label"":""Atiende con paciencia y respeto""},""i1"":{""score"":100,""label"":""Saluda y despide cordialmente""},""i3"":{""label"":""Entrega órdenes con frase de cierre"",""score"":100}},""score"":100},""carnes"":{""score"":100,""items"":{""i2"":{""score"":100,""label"":""Utensilios limpios, no golpear espátulas""},""i1"":{""score"":100,""label"":""Controla temperatura (450°/300°) y tiempos""},""i3"":{""score"":100,""label"":""Escurre carnes y rota producto (FIFO)""},""i4"":{""score"":100,""label"":""Vigila cebolla asada y porciones""}}},""alimentos"":{""items"":{""i1"":{""score"":100,""label"":""Respeta porciones estándar (cucharas)""},""i2"":{""score"":100,""label"":""Quesadillas bien calientes, sin quemar""},""i3"":{""score"":100,""label"":""Burritos bien enrollados, sin dorar de más""},""i4"":{""score"":100,""label"":""Stickers correctos donde aplica""}},""score"":100},""aseo"":{""items"":{""i2"":{""label"":""Uñas cortas, sin joyas/auriculares"",""score"":100},""i1"":{""score"":100,""label"":""Uniforme limpio y completo""},""i3"":{""label"":""Uso correcto de gorra y guantes"",""score"":100}},""score"":100},""tortillas"":{""score"":100,""items"":{""i2"":{""label"":""Máx 5 tacos por plato (presentación)"",""score"":100},""i3"":{""score"":100,""label"":""Reponer a tiempo y mantener frescura""},""i1"":{""score"":100,""label"":""Tortillas bien calientes (aceite solo en orillas)""}}},""limpieza"":{""items"":{""i4"":{""label"":""Exterior y basureros limpios"",""score"":60},""i3"":{""label"":""Baños con insumos completos y sin olores"",""score"":100},""i1"":{""label"":""Cubetas rojas con sanitizer tibio"",""score"":100},""i2"":{""score"":100,""label"":""Plancha limpia y sin residuos""}},""score"":90},""bitacoras"":{""score"":100,""items"":{""i2"":{""label"":""Bitácora de temperaturas al día"",""score"":100},""i3"":{""score"":100,""label"":""Registros de limpieza firmados""},""i1"":{""score"":100,""label"":""Checklist apertura/cierre completo""}}}}",https://drive.google.com/file/d/1kuipcaB3ckKMn2xXTkcuWbyszuXxvGvb/view?usp=drivesdk,1kuipcaB3ckKMn2xXTkcuWbyszuXxvGvb,https://drive.google.com/drive/folders/1WBhtIO1_aI1l88rgt4EWIA2asnbfK75j,1WBhtIO1_aI1l88rgt4EWIA2asnbfK75j,35,46,11,2025,0e4ef339-58e5-4cb7-8d18-233901753582,cerrado,Roque,Roque,Roque,cerrado
11/10/2025 14:53:02,2025-11-10,14:31,AM,Lynwood,Wilian Aguilar,100,100,100,87,100,100,100,98,1 mantener la salsa ranchera con caldo respectivo,"{""servicio"":{""score"":100,""items"":{""i4"":{""label"":""Evita charlas personales en línea"",""score"":100},""i2"":{""label"":""Atiende con paciencia y respeto"",""score"":100},""i1"":{""label"":""Saluda y despide cordialmente"",""score"":100},""i3"":{""score"":100,""label"":""Entrega órdenes con frase de cierre""}}},""bitacoras"":{""score"":100,""items"":{""i2"":{""label"":""Bitácora de temperaturas al día"",""score"":100},""i3"":{""score"":100,""label"":""Registros de limpieza firmados""},""i1"":{""label"":""Checklist apertura/cierre completo"",""score"":100}}},""limpieza"":{""score"":100,""items"":{""i1"":{""score"":100,""label"":""Cubetas rojas con sanitizer tibio""},""i2"":{""label"":""Plancha limpia y sin residuos"",""score"":100},""i3"":{""label"":""Baños con insumos completos y sin olores"",""score"":100},""i4"":{""score"":100,""label"":""Exterior y basureros limpios""}}},""carnes"":{""score"":100,""items"":{""i3"":{""label"":""Escurre carnes y rota producto (FIFO)"",""score"":100},""i1"":{""label"":""Controla temperatura (450°/300°) y tiempos"",""score"":100},""i2"":{""label"":""Utensilios limpios, no golpear espátulas"",""score"":100},""i4"":{""score"":100,""label"":""Vigila cebolla asada y porciones""}}},""alimentos"":{""score"":100,""items"":{""i2"":{""label"":""Quesadillas bien calientes, sin quemar"",""score"":100},""i1"":{""score"":100,""label"":""Respeta porciones estándar (cucharas)""},""i3"":{""label"":""Burritos bien enrollados, sin dorar de más"",""score"":100},""i4"":{""score"":100,""label"":""Stickers correctos donde aplica""}}},""aseo"":{""items"":{""i2"":{""score"":100,""label"":""Uñas cortas, sin joyas/auriculares""},""i1"":{""score"":100,""label"":""Uniforme limpio y completo""},""i3"":{""label"":""Uso correcto de gorra y guantes"",""score"":100}},""score"":100},""tortillas"":{""score"":87,""items"":{""i2"":{""score"":100,""label"":""Máx 5 tacos por plato (presentación)""},""i1"":{""label"":""Tortillas bien calientes (aceite solo en orillas)"",""score"":100},""i3"":{""score"":60,""label"":""Reponer a tiempo y mantener frescura""}}}}",https://drive.google.com/file/d/1OhYI2D8-V4kie3V-87QqzKZ9p8nFun0A/view?usp=drivesdk,1OhYI2D8-V4kie3V-87QqzKZ9p8nFun0A,https://drive.google.com/drive/folders/1qBgx0ow9ix8w5rW1X9_lJZgIZax-lyrC,1qBgx0ow9ix8w5rW1X9_lJZgIZax-lyrC,36,46,11,2025,349070af-cb09-4474-87e2-348f49bfa1c0,cerrado,Roque,Roque,Roque,cerrado
11/10/2025 18:31:42,2025-11-10,18:30,PM,Lynwood,Wilian Aguilar,100,100,100,100,100,100,100,100,,"{""carnes"":{""items"":{""i4"":{""label"":""Vigila cebolla asada y porciones"",""score"":0},""i2"":{""score"":100,""label"":""Utensilios limpios, no golpear espátulas""},""i1"":{""score"":100,""label"":""Controla temperatura (450°/300°) y tiempos""},""i3"":{""score"":100,""label"":""Escurre carnes y rota producto (FIFO)""}},""score"":100},""aseo"":{""score"":100,""items"":{""i2"":{""score"":100,""label"":""Uñas cortas, sin joyas/auriculares""},""i3"":{""label"":""Uso correcto de gorra y guantes"",""score"":100},""i1"":{""score"":100,""label"":""Uniforme limpio y completo""}}},""servicio"":{""score"":100,""items"":{""i1"":{""score"":100,""label"":""Saluda y despide cordialmente""},""i2"":{""score"":100,""label"":""Atiende con paciencia y respeto""},""i4"":{""label"":""Evita charlas personales en línea"",""score"":100},""i3"":{""label"":""Entrega órdenes con frase de cierre"",""score"":100}}},""bitacoras"":{""score"":100,""items"":{""i1"":{""label"":""Checklist apertura/cierre completo"",""score"":100},""i2"":{""score"":100,""label"":""Bitácora de temperaturas al día""},""i3"":{""score"":100,""label"":""Registros de limpieza firmados""}}},""alimentos"":{""score"":100,""items"":{""i1"":{""score"":100,""label"":""Respeta porciones estándar (cucharas)""},""i3"":{""score"":100,""label"":""Burritos bien enrollados, sin dorar de más""},""i2"":{""label"":""Quesadillas bien calientes, sin quemar"",""score"":100},""i4"":{""score"":100,""label"":""Stickers correctos donde aplica""}}},""tortillas"":{""items"":{""i1"":{""score"":100,""label"":""Tortillas bien calientes (aceite solo en orillas)""},""i3"":{""label"":""Reponer a tiempo y mantener frescura"",""score"":100},""i2"":{""label"":""Máx 5 tacos por plato (presentación)"",""score"":100}},""score"":100},""limpieza"":{""score"":100,""items"":{""i2"":{""label"":""Plancha limpia y sin residuos"",""score"":100},""i1"":{""label"":""Cubetas rojas con sanitizer tibio"",""score"":100},""i3"":{""score"":100,""label"":""Baños con insumos completos y sin olores""},""i4"":{""label"":""Exterior y basureros limpios"",""score"":100}}}}",,,https://drive.google.com/drive/folders/11DZBVZHWbsc-BqJPHQGf6hpBIu8qCSD9,11DZBVZHWbsc-BqJPHQGf6hpBIu8qCSD9,37,46,11,2025,4476cebe-d96d-492d-ab6f-61f48d85b027,cerrado,Roque,Roque,Roque,cerrado
11/11/2025 15:02:42,2025-11-11,14:58,AM,Bell,Wilian Aguilar,100,100,100,100,100,100,100,100,1-Siempre esperar que el piso trapeado este seco y no dejar el secador sin vigilancia,"{""carnes"":{""score"":100,""items"":{""i2"":{""label"":""Utensilios limpios, no golpear espátulas"",""score"":100},""i3"":{""label"":""Escurre carnes y rota producto (FIFO)"",""score"":100},""i1"":{""label"":""Controla temperatura (450°/300°) y tiempos"",""score"":100},""i4"":{""label"":""Vigila cebolla asada y porciones"",""score"":100}}},""tortillas"":{""items"":{""i3"":{""label"":""Reponer a tiempo y mantener frescura"",""score"":100},""i1"":{""score"":100,""label"":""Tortillas bien calientes (aceite solo en orillas)""},""i2"":{""score"":100,""label"":""Máx 5 tacos por plato (presentación)""}},""score"":100},""bitacoras"":{""items"":{""i2"":{""label"":""Bitácora de temperaturas al día"",""score"":100},""i3"":{""label"":""Registros de limpieza firmados"",""score"":100},""i1"":{""label"":""Checklist apertura/cierre completo"",""score"":100}},""score"":100},""alimentos"":{""score"":100,""items"":{""i2"":{""label"":""Quesadillas bien calientes, sin quemar"",""score"":100},""i4"":{""score"":100,""label"":""Stickers correctos donde aplica""},""i3"":{""score"":100,""label"":""Burritos bien enrollados, sin dorar de más""},""i1"":{""score"":100,""label"":""Respeta porciones estándar (cucharas)""}}},""servicio"":{""items"":{""i4"":{""label"":""Evita charlas personales en línea"",""score"":100},""i1"":{""label"":""Saluda y despide cordialmente"",""score"":100},""i2"":{""label"":""Atiende con paciencia y respeto"",""score"":100},""i3"":{""label"":""Entrega órdenes con frase de cierre"",""score"":100}},""score"":100},""aseo"":{""score"":100,""items"":{""i2"":{""label"":""Uñas cortas, sin joyas/auriculares"",""score"":100},""i1"":{""score"":100,""label"":""Uniforme limpio y completo""},""i3"":{""label"":""Uso correcto de gorra y guantes"",""score"":100}}},""limpieza"":{""items"":{""i2"":{""label"":""Plancha limpia y sin residuos"",""score"":100},""i3"":{""score"":100,""label"":""Baños con insumos completos y sin olores""},""i4"":{""score"":100,""label"":""Exterior y basureros limpios""},""i1"":{""score"":100,""label"":""Cubetas rojas con sanitizer tibio""}},""score"":100}}",https://drive.google.com/file/d/13BfVj6PAyZI9DzGAPQqIarUGdm7XsC0U/view?usp=drivesdk,13BfVj6PAyZI9DzGAPQqIarUGdm7XsC0U,https://drive.google.com/drive/folders/14GfA-afNm4D5mD7r5rWjFdRahDpS2oAP,14GfA-afNm4D5mD7r5rWjFdRahDpS2oAP,38,46,11,2025,d12dce3b-c05a-4180-8940-67b97db7d7c9,cerrado,Roque,Roque,Roque,cerrado
